raw_words,sentiment,aspect,opinion,subjectivity
"The room was very nice , large and clean with lots of light and an AC unit .",POS,room,"very nice, clean, large",0
"The room was very private , filled with beautiful windows , and was clean and comfortable .",POS,windows,beautiful,0
"The room was very private , filled with beautiful windows , and was clean and comfortable .",POS,room,"very private, clean, comfortable",0
The room was very welcoming and clean !,POS,room,"clean, very welcoming",0
The rooms ate close each other so I can hear the voice of the people and sometimes is annoying .,NEG,rooms,annoying,0
The rooms had all the charm of Beacon Hill without being cluttered .,POS,rooms,charm,0
"The rooms were clean , towels were folded and ready for use and the rooftop was even better than in the pictures .",POS,rooftop,better,0
"The rooms were clean , towels were folded and ready for use and the rooftop was even better than in the pictures .",POS,rooms,clean,0
The self check in process was very easy and I was nicely surprised by the cleanness of the studio .,POS,cleanness,nicely surprised,0
The self check in process was very easy and I was nicely surprised by the cleanness of the studio .,POS,self check in process,very easy,0
The shared bathroom was 2 floors down via steep stairs .,NEG,stairs,steep,0
The shower drains need a good snake to ensure the water flows .,NEG,shower,NULL,1
The Silver Line ( bus ) from Logan Airport stops close behind the apartment buildings ( another stop is by the WTC ) .,POS,NULL,NULL,1
"The single plus ( and it is a big one ) is that the location is very good , near Boston Common and Charles St. restaurants and shops .",POS,location,very good,0
"The size of the house was perfect , as both boys had their own room .",POS,size,perfect,0
The small breakfast is refreshing and easy .,POS,breakfast,"refreshing, easy",0
The space is a small lofted studio that 's kept neat and in a secured building .,POS,space,neat,0
The space is a small lofted studio that 's kept neat and in a secured building .,POS,building,secured,0
"The space is clean and comfortable , and you ca n't beat the location .",POS,location,ca n't beat,0
"The space is clean and comfortable , and you ca n't beat the location .",POS,space,"clean, comfortable",0
The space is comfy and clean .,POS,space,"clean, comfy",0
The space is incredibly clean !,POS,space,incredibly clean,0
The space is very comfortable in the centre of a busy shopping street,POS,NULL,very comfortable,0
The space is very cute and comfortable .,POS,space,"comfortable, very cute",0
"The space itself is so gorgeous , and while we never met Tiffany , she was incredibly helpful and responsive throughout the booking process and our actual stay .",POS,Tiffany,"responsive, incredibly helpful",0
"The space itself is so gorgeous , and while we never met Tiffany , she was incredibly helpful and responsive throughout the booking process and our actual stay .",POS,space,so gorgeous,0
The space was perfect for my no frills work trip needs .,POS,space,perfect,0
The spacious bathroom was always spotless .,POS,bathroom,"spacious, spotless",0
The spot was very clean !,POS,spot,very clean,0
The stairs are a lot and a bit tricky so it might be difficult for people who are in bad physical shape or have some disability .,NEG,stairs,"bit tricky, difficult",0
The stairs are definitely steep and people who stay here should be fit enough to handle 3 flights of steep narrow stairs .,POS,stairs,"definitely steep, narrow, steep",0
The stay at Valerie and Jason was great !,POS,NULL,great,0
The stay was an almost hotel-like experience with the casual atmosphere of a shared space .,POS,atmosphere,casual,0
The stay was an almost hotel-like experience with the casual atmosphere of a shared space .,POS,NULL,NULL,0
"The steps to the unit are steep , but it 's worth the climb .",NEG,steps,steep,0
The street is quiet and residential .,POS,street,quiet,0
The street was so lovely and so was the apartment .,POS,apartment,so lovely,0
The street was so lovely and so was the apartment .,POS,street,so lovely,0
"The studio is small , but highly functional .",POS,studio,highly functional,0
"The studio is small , but highly functional .",NEG,studio,small,0
The Studio is very close to Hardvard ave station ( green line ) .,POS,Studio,NULL,1
"The studio suite was very clean , comfortable , in a beautiful building , and the perfect size for two people .",POS,building,beautiful,0
"The studio suite was very clean , comfortable , in a beautiful building , and the perfect size for two people .",POS,size,perfect,0
"The studio suite was very clean , comfortable , in a beautiful building , and the perfect size for two people .",POS,studio suite,"very clean, comfortable",0
The subway is just a short walk away and you 'll get to downtown Boston in just a few stops .,POS,NULL,NULL,1
The suggestions on where to eat and visit was spot on .,POS,suggestions,spot on,0
The sunny room ( technically called the Luxury room ) is very peaceful and the unit is well-appointed .,POS,sunny room,very peaceful,0
The sunny room ( technically called the Luxury room ) is very peaceful and the unit is well-appointed .,POS,unit,well-appointed,0
The T is right there too for easy commute downtown .,POS,NULL,NULL,1
The T was easily accessible .,POS,NULL,NULL,1
The terrasse roof ( access not easy ) is to be shared with other guests which is not a problem but good to know .,NEG,terrasse roof,not easy,0
The toiletries & accomodations offered were great too !,POS,accomodations,great,0
The toiletries & accomodations offered were great too !,POS,toiletries,great,0
The tub did n't appear clean and bathroom overall needed a little TLC and good cleaning .,POS,tub,did n't appear clean,0
The tub did n't appear clean and bathroom overall needed a little TLC and good cleaning .,POS,bathroom,NULL,0
"The two things that made it a little disappointing for me was apartment size / amenities vs the cost , and the sleep situation .",NEG,amenities,disappointing,0
"The two things that made it a little disappointing for me was apartment size / amenities vs the cost , and the sleep situation .",NEG,cost,disappointing,0
"The two things that made it a little disappointing for me was apartment size / amenities vs the cost , and the sleep situation .",NEG,size,disappointing,0
"The two things that made it a little disappointing for me was apartment size / amenities vs the cost , and the sleep situation .",NEG,sleep situation,disappointing,0
"The Uber drivers did n't have anything positive to say about the neighborhood around this apartment , but we did n't have any problems during our stay .",POS,NULL,problems,0
"The unit at 21 Beacon is charming , and although it 's small ( medium/large studio size ) it was perfect for our needs .",POS,unit,"charming, perfect",0
"The unit at 21 Beacon is charming , and although it 's small ( medium/large studio size ) it was perfect for our needs .",NEG,unit,small,0
The unit is also close to public transportation in order to see other sites .,POS,unit,NULL,1
The unit is quaint and comfortable and very very central .,POS,unit,"quaint, comfortable, very very central",0
The unit was as described and the location ca n't be beat !,POS,location,NULL,1
"The unit was stylish , clean and cozy .",POS,unit,"clean, stylish, cozy",0
The updated private bathroom was fantastic .,POS,private bathroom,fantastic,0
"The upstairs balcony view is absolutely gorgeous , overlooking the Boston Commons and Statehouse .",POS,upstairs balcony view,absolutely gorgeous,0
"The view beautiful , relaxing and peaceful .",POS,view,"beautiful, peaceful, relaxing",0
"The view from our room was amazing , the bathroom was private , the room was spotless and the bed was perfect .",POS,view,amazing,0
"The view from our room was amazing , the bathroom was private , the room was spotless and the bed was perfect .",POS,bed,perfect,0
"The view from our room was amazing , the bathroom was private , the room was spotless and the bed was perfect .",POS,bathroom,private,0
"The view from our room was amazing , the bathroom was private , the room was spotless and the bed was perfect .",POS,room,spotless,0
The view from the balcony on 10th floor great .,POS,view,great,0
The view from the dining space is unbeatable .,POS,view,unbeatable,0
The view from the roof terrace is unrivalled .,POS,view,unrivalled,0
The view from the roof top deck is spectacular .,POS,view,spectacular,0
The view from the rooftop deck is an extra bonus .,POS,view,extra bonus,0
The view from the rooftop deck was world class - and the pictures on this rental 's site do not do it justice .,POS,view,world class,0
The view from the terrace is terrific and the location could n't be better !,POS,location,better,0
The view from the terrace is terrific and the location could n't be better !,POS,view,terrific,0
The view is amazing !,POS,view,amazing,0
The view is beautiful day and night .,POS,view,beautiful,0
The view is great and much better than many of the hotels in that area .,POS,view,"much better, great",0
"The view of the harbor and the airport is spectacular , and George is definitely a Superhost by my standards .",POS,George,NULL,0
"The view of the harbor and the airport is spectacular , and George is definitely a Superhost by my standards .",POS,view,spectacular,0
The views are great and George is a great host !,POS,George,great,0
The views are great and George is a great host !,POS,views,great,0
The views are lovely and the room is large and spacious with lots of storage space .,POS,room,"large, spacious",0
The views are lovely and the room is large and spacious with lots of storage space .,POS,storage space,lots of,0
The views are lovely and the room is large and spacious with lots of storage space .,POS,views,lovely,0
The views are spectacular .,POS,views,spectacular,0
"The walk from the airport T station to the house was about 10 minutes , but definitely doable and worth it .",POS,house,"worth, definitely doable",0
The walk to Roxbury MTBA Station is just a few minutes .,POS,NULL,NULL,1
The walk to the T was manageable .,POS,NULL,manageable,0
The washer and dryer within the apartment was useful .,POS,dryer,useful,0
The washer and dryer within the apartment was useful .,POS,washer,useful,0
The washer/dryer was very handy .,POS,washer/dryer,very handy,0
"The water is great , the electric locks make it simple , and it was an affordable place to stay .",POS,place,affordable,0
"The water is great , the electric locks make it simple , and it was an affordable place to stay .",POS,water,"great, simple",0
"The water is great , the electric locks make it simple , and it was an affordable place to stay .",POS,electric locks,NULL,0
"The water is hot , and the water pressure for showers was great .",POS,water pressure,great,0
"The water is hot , and the water pressure for showers was great .",POS,water,hot,0
The weather was beautiful and that roof deck was a great way to spend an afternoon in Beacon Hill .,POS,roof deck,great,0
The welcome snacks were a nice touch and very much appreciated .,POS,welcome snacks,"very much appreciated, nice",0
"The whole experience , from arrival to departure , was simply easy .",POS,NULL,simply easy,0
"The whole house was very clean , cosy and tasteful decorated .",POS,house,"very clean, tasteful, cosy",0
The Wi-Fi worked well .,POS,Wi-Fi,well,0
Their apartment is adorable and very clean .,POS,apartment,"adorable, very clean",0
"Their home is charming , clean and at a walking distance from the airport T station which is very convenient .",POS,home,"clean, charming, very convenient, NULL",0
Their home was beautiful and clean .,POS,home,"clean, beautiful",0
Their home was located in a convenient proximity to the airport and stocked with great amenities to make my stay comfortable .,POS,NULL,comfortable,0
Their home was located in a convenient proximity to the airport and stocked with great amenities to make my stay comfortable .,POS,home,convenient,0
Their home was located in a convenient proximity to the airport and stocked with great amenities to make my stay comfortable .,POS,amenities,"NULL, great",0
Their home was nice and clean .,POS,home,"clean, nice",0
Their house is immaculate and they had everything thought out for a comfortable stay .,POS,house,immaculate,0
Their house is immaculate and they had everything thought out for a comfortable stay .,POS,they,NULL,0
Their house is super clean everywhere .,POS,house,super clean,0
"Their house is very close to the subway station , with very safe neighborhood .",POS,house,NULL,0
"Their house is very close to the subway station , with very safe neighborhood .",POS,neighborhood,very safe,0
Their place is a convenient 15 min drive from central Boston and super close to the airport .,POS,place,"convenient, NULL",0
"Their place is an easy walk to the train station , which made it easier to get around than We expected .",POS,place,easy,0
"Their place is spotless , comfortable , and really felt like home for the weekend .",POS,NULL,NULL,0
"Their place is spotless , comfortable , and really felt like home for the weekend .",POS,place,"spotless, comfortable",0
"Their place is very convenient to both the airport and getting downtown , making it a great choice for a weekend stay in Boston .",POS,place,"very convenient, great",0
"Their place was clean , easy to get to , and quiet .",POS,place,"clean, quiet, easy",0
"There are 3 flights of very steep , old stairs .",NEG,stairs,steep,0
"There are people that live upstairs , but I barely heard anything while I was there for my stay .",POS,people,NULL,1
There are shops and restaurants of every cuisine imaginable withing walking distance .,POS,NULL,NULL,1
"There is a grocery store a 15 min walk away , which was easy to walk from with a few groceries for breakfasts and snacks .",POS,NULL,easy,0
"There is a large Whole Food store within walking distance : a little pricey , but great for grocery .",POS,NULL,NULL,1
"There is a mini fridge in the room , which was great .",POS,mini fridge,great,0
"There is a parking garage in the building with overnight parking , but it costs extra .",NEU,parking garage,NULL,1
"There is a wonderful playground right behind the building , and my son had a blast .",POS,NULL,NULL,1
There is even a parking spot !,POS,parking spot,NULL,1
There is no sir conditioning inn the main space but the fans work perfectly .,POS,fans,perfectly,0
"There is nothing I would have liked to be different , and I can only recommend staying with them .",POS,them,recommend,0
"There 's a playground just a block away , and a nice path for walking between the Back Bay station and Mass Ave .",POS,NULL,NULL,1
"There 's great security at the building ( 24/7 concierge ) , and it 's just top notch in every regard .",POS,building,security,0
"There 's great security at the building ( 24/7 concierge ) , and it 's just top notch in every regard .",POS,NULL,top notch,0
"There 's plenty to do in Charlestown , or it 's just a short walk to get downtown .",POS,NULL,NULL,1
There was a very nice welcome book with lots of great information .,POS,information,lots of great,0
There was a very nice welcome book with lots of great information .,POS,welcome book,very nice,0
"There was also a coffee maker , coffee , and sugar , what more could you ask for ?",POS,NULL,NULL,1
There was also a window A/C unit which was n't bad at all .,POS,window A/C,n't bad,0
There was coffee waiting for us downstairs every morning and we were welcome to anything in the fridge .,POS,NULL,NULL,1
There was dirty laundry in the hamper ( these two things combined make her cleaning fee an outrageous expense even though it is relatively cheap ) .,NEG,laundry,dirty,0
There was dirty laundry in the hamper ( these two things combined make her cleaning fee an outrageous expense even though it is relatively cheap ) .,NEG,cleaning fee,outrageous,0
There was dirty laundry in the hamper ( these two things combined make her cleaning fee an outrageous expense even though it is relatively cheap ) .,NEU,cleaning fee,relatively cheap,0
"There was even an additional electric radiator in the room , which I found useful during very cold winter days .",POS,electric radiator,useful,0
"There was fresh coffee every morning , as well as fresh fruit , fresh bread ( which was amazing ) and told us to help ourselves to anything in the refrigerator .",POS,fruit,"amazing, fresh",0
"There was fresh coffee every morning , as well as fresh fruit , fresh bread ( which was amazing ) and told us to help ourselves to anything in the refrigerator .",POS,bread,"fresh, amazing",0
"There was fresh coffee every morning , as well as fresh fruit , fresh bread ( which was amazing ) and told us to help ourselves to anything in the refrigerator .",POS,coffee,"fresh, amazing",0
"There was no light in the narrow , steep stairs between the floors and it never did get fixed while we were there .",NEG,NULL,NULL,0
"There was no light in the narrow , steep stairs between the floors and it never did get fixed while we were there .",NEG,light,NULL,0
"There was no light in the narrow , steep stairs between the floors and it never did get fixed while we were there .",NEG,stairs,"steep, narrow",0
There was nothing lacking in our stay in her lovely home .,POS,home,lovely,0
There was nothing lacking in our stay in her lovely home .,POS,NULL,NULL,0
There was plenty of space for our family of 4 .,POS,space,plenty,0
"There were a couple of quirks about the space but it was definitely worth it for the price , location , cleanliness , and wonderful communication .",POS,cleanliness,definitely worth,0
"There were a couple of quirks about the space but it was definitely worth it for the price , location , cleanliness , and wonderful communication .",POS,location,definitely worth,0
"There were a couple of quirks about the space but it was definitely worth it for the price , location , cleanliness , and wonderful communication .",POS,price,definitely worth,0
"There were a couple of quirks about the space but it was definitely worth it for the price , location , cleanliness , and wonderful communication .",POS,space,NULL,0
"There were a couple of quirks about the space but it was definitely worth it for the price , location , cleanliness , and wonderful communication .",POS,communication,"wonderful, definitely worth",0
There were absolutely no surprises upon getting there because she provides the most detailed directions and instructions .,POS,NULL,NULL,1
There were absolutely no surprises upon getting there because she provides the most detailed directions and instructions .,POS,directions,NULL,1
There were absolutely no surprises upon getting there because she provides the most detailed directions and instructions .,POS,instructions,NULL,1
There were amenities in the area and it was never a problem to find food .,POS,area,NULL,1
"There were many choices for breakfast ; the fireplace made the living room extra special ; our bedroom , besides being very quiet , was spacious with great views thru large windows .",POS,living room,extra special,0
"There were many choices for breakfast ; the fireplace made the living room extra special ; our bedroom , besides being very quiet , was spacious with great views thru large windows .",POS,views,great,0
"There were many choices for breakfast ; the fireplace made the living room extra special ; our bedroom , besides being very quiet , was spacious with great views thru large windows .",POS,windows,large,0
"There were many choices for breakfast ; the fireplace made the living room extra special ; our bedroom , besides being very quiet , was spacious with great views thru large windows .",POS,choices for breakfast,NULL,0
"There were many choices for breakfast ; the fireplace made the living room extra special ; our bedroom , besides being very quiet , was spacious with great views thru large windows .",POS,fireplace,NULL,0
"There were many choices for breakfast ; the fireplace made the living room extra special ; our bedroom , besides being very quiet , was spacious with great views thru large windows .",POS,bedroom,"very quiet, spacious",0
There were no blankets on any of the beds ( only light summer comforters ) .,NEG,blankets,NULL,1
"They also think of the little things we would want like coffee , a quick breakfast , and a comfy bed !",POS,bed,comfy,0
"They also think of the little things we would want like coffee , a quick breakfast , and a comfy bed !",POS,breakfast,quick,0
"They are both very friendly , helpful and humorous !",POS,They,"helpful, very friendly, humorous",0
They are conveniently located near Boston Logan airport and no too far from the train station .,POS,They,"conveniently, NULL",0
They are extremely hospitable and always willing to chat !,POS,They,"willing, extremely hospitable",0
They are great .. i would stay here again,POS,They,great,0
They are great hosts and try to help you in anyway you can think of !,POS,They,"great, help",0
"They are one stop from the city , which was super convenient .",POS,NULL,super convenient,0
"They are really nice , warm and caring people , staying at their place was like being at home .",POS,They,"caring, really nice, warm",0
"They are really nice , warm and caring people , staying at their place was like being at home .",POS,NULL,NULL,0
They are very friendly and helpful .,POS,They,"very friendly, helpful",0
They are very kind and helpful people .,POS,They,"very kind, helpful",0
They are very nice hosts .,POS,They,very nice,0
They did have one night where they were woken up by a bug crawling on them ( this could happen anywhere though ) .,NEG,NULL,bug,0
"They do have a small breakfast offered each morning , which was nice .",POS,breakfast,nice,0
They even gave me a walking map of Boston with directions to can't-miss sights .,POS,They,NULL,1
They even let me store my luggage beyound check out time .,POS,They,NULL,1
They gave us some nice advices for traveling around in Boston during the breakfast time !,POS,advices,nice,0
They have a really nice and clean home and our own room was perfect ( and the biggest in the house ) .,POS,room,"perfect, biggest",0
They have a really nice and clean home and our own room was perfect ( and the biggest in the house ) .,POS,home,"really nice, clean",0
They helped me and took care of me in the best way .,POS,way,best,0
They helped me and took care of me in the best way .,POS,They,"took care of, helped",0
They helped us to find the right trains and told us what we need to see and helped us to find a good restaurant .,POS,They,NULL,1
They instantly welcomed me as a friend .,POS,They,instantly welcomed,0
They let us get situated before offering us to join them for a delicious home cooked lunch .,POS,home cooked lunch,delicious,0
They offer a private entrance and easily walkable to the transit system .,POS,private entrance,easily,0
"They offered me breakfast in the morning including Valerie 's delicious , homemade breakfast bars .",POS,breakfast bars,delicious,0
"They provide everything you need ( bottles of water , small breakfast , toiletries etc ) .",POS,NULL,NULL,1
"They provide everything you need ( bottles of water , small breakfast , toiletries etc ) .",POS,They,NULL,1
"They provided me help and information , plus a delicious breakfast with homemade cake and Nespresso coffee .",POS,breakfast,delicious,0
"They provided me help and information , plus a delicious breakfast with homemade cake and Nespresso coffee .",POS,They,NULL,0
They put out breakfast for us in the morning with coffee and bread and an assortment of spreads .,POS,breakfast,NULL,1
They really thought of everything .,POS,They,NULL,1
They shared great recommendations for sightseeing and made excellent baked goods !,POS,baked goods,excellent,0
They shared great recommendations for sightseeing and made excellent baked goods !,POS,recommendations,great,0
"They took time to give us tips , Bake a delicious cake for our breakfast ... : D",POS,cake,delicious,0
They waited for us to let us in and show us the appartment although we arrived quite late .,POS,They,NULL,1
"They were always available to handle a quick question about the city , a restaurant , or what to do for the day .",POS,They,available,0
"They were not just friendly , but they were also generous with their home and time .",POS,They,"friendly, generous",0
"They were so friendly and personable , and it was an EXCELLENT experience .",POS,NULL,EXCELLENT,0
"They were so friendly and personable , and it was an EXCELLENT experience .",POS,They,"so friendly, personable",0
They were so hospitable and very friendly .,POS,They,"very friendly, so hospitable",0
"They were very accommodating with our late , early AM arrival and communicated with us quickly / often prior to getting there .",POS,They,"quickly, very accommodating",0
They were very considerate .,POS,They,very considerate,0
They were very easy going and helpful throughout our stay at their place .,POS,They,"helpful, very easy going",0
They were very friendly and approachable .,POS,They,"very friendly, approachable",0
They were very welcoming and gave us great info and recommendations about the city and things to do/food to eat while we were there !,POS,info and recommendations,great,0
They were very welcoming and gave us great info and recommendations about the city and things to do/food to eat while we were there !,POS,They,very welcoming,0
This a a terrific space !,POS,space,terrific,0
"This airbnb in walking distance to the subway , you can reach downtown very quickly .",POS,airbnb,"very quickly, NULL",0
This also means the location is perfect for getting around .,POS,location,perfect,0
