raw_words,sentiment,aspect,opinion,subjectivity
I am sad because I love these very much and I had great luck last year I hope Amazon and google can help,POS,NULL,love,0
"I am size 5.5-6 normally , and this one fit me perfectly .",POS,this one,perfectly,0
I am so glad I took everyone 's advise to get a wide width ( which I never need ) They fit perfectly .,POS,They,perfectly,0
I am so glad I took everyone 's advise to get a wide width ( which I never need ) They fit perfectly .,POS,width,so glad,0
I am so pleased with this purchase .,POS,NULL,so pleased,0
I am tall and all leg and these fit me very well .,POS,NULL,very well,0
I am thinking of possibly getting other colors .,POS,NULL,NULL,1
I am totally satisfied with my purchase .,POS,NULL,totally satisfied,0
"I am usually an 8.5W-9 in regular shoes , but I know from experience that Capezios tend to run a little small so the 9W 's were perfect for me .",POS,9W 's,perfect,0
"i am very happy with the weight of the fabric , color and fit , I love hoodies and will be back for more .",POS,hoodies,love,0
"i am very happy with the weight of the fabric , color and fit , I love hoodies and will be back for more .",POS,NULL,very happy,0
"i am very happy with the weight of the fabric , color and fit , I love hoodies and will be back for more .",POS,color,very happy,0
"I am very pale , especially my legs , and the color nude was pretty spot on .",POS,color,pretty,0
I assume they sent me the wrong color but the shoes themselves did not say what color they were .,NEG,they,NULL,1
I ballroom dance and wear them with my Latin dress and they make my legs look beautiful .,POS,they,beautiful,0
I barely noticed I had shoes on other than they were a little slippery on the concrete dance floor .,NEG,they,a little slippery,0
I believe they only think very tall thin women are dancers ; not short more muscular older athlete .,NEG,they,NULL,1
I bought 2 other pairs for other cast members !,POS,NULL,NULL,1
I bought an XL based on the chart and it 's way too big .,NEG,NULL,too big,0
"I bought classic light toast , I 'll be ordering a second pair in just light toast to better fit my skin tone ( super pale ) and they run a little small in the hips , so getting a size up in my opinion is a good idea .",NEG,they,a little small,0
I bought them again .,POS,them,NULL,1
I bought them also due to the quality of Life Stride shoes which I have worn in the past .,POS,quality,NULL,1
"I bought them for a Wonder Woman costume , and they are perfect .",POS,they,perfect,0
I bought them for my daughter and she loves them .,POS,them,loves,0
I bought them in a few colors and will buy more .,POS,them,NULL,1
"I bought them mainly because I have nerve damage , as well as severe arthritis in my legs , and I have talked to countless Hooters girls who have all sworn by them because the ones that have gotten in the past are simply too expensive , but these danskins are of the same quality , and hold up , and keep the gloss alive for a long time as well as the one other important reason to wear them is support which is my reason for wearing them .",POS,danskins,NULL,0
"I bought them mainly because I have nerve damage , as well as severe arthritis in my legs , and I have talked to countless Hooters girls who have all sworn by them because the ones that have gotten in the past are simply too expensive , but these danskins are of the same quality , and hold up , and keep the gloss alive for a long time as well as the one other important reason to wear them is support which is my reason for wearing them .",NEG,the ones,too expensive,0
I bought them to wear for aerial lyra training.the fit is good.very pleased .,POS,NULL,"pleased, good.very",0
I bought these as a gift for my Mom who loves them .,POS,them,loves,0
"I bought these for my daughter , and they fit great !",POS,they,great,0
I bought these shoes at a store a few years ago and loved how they fit and were so comfortable .,POS,they,"loved, so comfortable",0
I bought these shoes to wear to a wedding ... . they were so comfortable I could have danced all night and nearly did ! !,POS,they,"so comfortable, NULL",0
I bought these thinking Danskin would not be a disappointment .,POS,Danskin,not be a disappointment,0
I bought these tights for Halloween and they were perfect for my I love Lucy/housewife costume .,POS,Lucy/housewife costume,love,0
I bought these tights for Halloween and they were perfect for my I love Lucy/housewife costume .,POS,they,perfect,0
I bought these tights for my beginning ballet class and they have been great .,POS,they,great,0
"I bought these to cover a leg tattoo , they did not .",NEG,they,NULL,1
I bought these to wear with my yoga leotard and they fit fine .,POS,they,fine,0
I bought this at a great price !,POS,price,great,0
I bought this same shoe several years ago and loved it ; I was despairing to see it wearing out !,POS,shoe,loved,0
I brought them for a Captain 's night on a cruise and they held up to the elegance of the night .,POS,they,NULL,1
I buy lots of dance tights but theses are smaller than usual Size up !,NEG,theses,smaller,0
"I buy the small/medium for my ( KIDS ) size 10 daughter , and they fit her great , but they definitely run small .",POS,they,great,0
"I buy the small/medium for my ( KIDS ) size 10 daughter , and they fit her great , but they definitely run small .",NEG,they,small,0
I buy these tights for my daughter all the time for dance .,POS,tights,NULL,1
"I can ' wear them at all , but they are cute .",NEG,them,NULL,0
"I can ' wear them at all , but they are cute .",POS,they,cute,0
I can already tell the left boot fits different than the right and has a spot that is rubbing into the ankle .,NEG,NULL,NULL,1
I can dance 4 hours without any complaining .,POS,NULL,NULL,1
I can not believe the quality of this shirt for under $ 10 .,POS,quality,NULL,1
I can not imagine a woman trying to fit in these .,NEG,NULL,NULL,1
"I can not speak for longevity as I have only had it a few weeks , but it looks very classy and not overkill on bling .",POS,NULL,very classy,0
I can see why cheer leaders and dancers wear these as they perfect the leg and give support .,POS,they,perfect,0
I can slippery them on and off easily during performance .,POS,them,NULL,1
"I can wear them now if not doing a lot of walking , but they are lather and will stretch a little , so I 'm happy with them .",POS,them,happy,0
I can't begin to tell you how disappointed I was in the Mimosa in a wide size .,NEG,Mimosa,disappointed,0
"I cant bring myself to put the shoes back on , and the sole is showing wear so it seems a return is not an option .",NEG,shoes,NULL,1
I can't wait to wear these to class !,POS,NULL,NULL,1
"I chose theae , since they were the smallest heel .",POS,theae,NULL,1
"I compared these to ones that aren't even as pretty locally , and these are a perfect bargain , for what you get .",POS,NULL,perfect bargain,0
"I consistently wear the same size no matter what the shoe , so surprised and a little disappointed that the straps on top are a little tight and overall fit is more narrow .",NEG,straps,"a little disappointed, a little tight",0
"I consistently wear the same size no matter what the shoe , so surprised and a little disappointed that the straps on top are a little tight and overall fit is more narrow .",NEG,NULL,more narrow,0
"I cosplay a character which wears a thong , I wear these to make my legs look a lot nicer .",POS,NULL,a lot nicer,0
I could barely get these on they were THAT small .,NEG,they,THAT small,0
"I could not find anything like these in my local stores , and although I was afraid to try these , I am extremely glad I did , they are perfect !",POS,they,"perfect, extremely glad",0
I could not get the Capezio on because they were way too tight .,NEG,Capezio,too tight,0
I could n't even get them up to my hips .,NEG,them,NULL,1
I could n't even stand in them much less walk .,NEG,them,NULL,1
I could probably have done a large but I was worried the waistband would be too tight ( I don't have a small waist ) .,NEG,waistband,too tight,0
"I 'd buy more colors , but they 're not always available in my size & width.My one quibble , the reason I ca n't give these shoes five stars , is that after a year or so of intermittent wear , no more than once a week , they tend to deteriorate , fast .",NEG,shoes,NULL,0
"I 'd buy more colors , but they 're not always available in my size & width.My one quibble , the reason I ca n't give these shoes five stars , is that after a year or so of intermittent wear , no more than once a week , they tend to deteriorate , fast .",NEG,they,deteriorate,0
I 'd definitely just get this on prime in case you need to return it and swap sizes .,NEG,NULL,NULL,1
I 'd gladly pay more for US shoes but why don't they fit ?,NEG,they,fit,0
I 'd gladly pay more for US shoes but why don't they fit ?,POS,US shoes,gladly,0
"I 'd ordered the Capezio Women 's Hold & Stretch Transition Tight , Light Suntan , Large few months ago which is way too small .",NEG,Capezio Women 's Hold & Stretch Transition Tight,too small,0
I definitely recommend them .,POS,them,definitely recommend,0
I did like this shoe .,POS,shoe,like,0
I did not like the style ; seemed more suited for an older lady .,NEG,style,did not like,0
I did not like this at all ... fit was too large and it 's too old ladyish for me ... sorry but had to return it ...,NEG,NULL,"too old ladyish, too large, did not like",0
I did n't like how sheer it was .,NEG,NULL,did n't like,0
I did n't need black and they were a little small .,NEG,they,a little small,0
I did order these a half size up and am super glad I did ... my daughter wears a size 7 always and the 7.5 fits perfectly .,POS,NULL,"super glad, perfectly",0
I did purchase a pair of Apara Gel Steppies ( Amazon sells them ) and they work pretty good to keep my feet from sliding forward and I like the fact that they are clear and stay put with the peel off adhesive .,POS,they,like,0
I did purchase a pair of Apara Gel Steppies ( Amazon sells them ) and they work pretty good to keep my feet from sliding forward and I like the fact that they are clear and stay put with the peel off adhesive .,POS,Apara Gel Steppies,pretty good,0
I did struggle to get them buckled because the straps are pretty stiff .,NEG,straps,pretty stiff,0
"I do like them , they are nicely glossy , and just to be clear there is a difference between glossy and shimmery .",POS,them,like,0
"I do like them , they are nicely glossy , and just to be clear there is a difference between glossy and shimmery .",POS,they,nicely glossy,0
I do like them but they are to dark .,POS,them,like,0
I do like them but they are to dark .,NEG,they,to dark,0
I do look forward to wearing them when the weather turns warmer .,POS,them,NULL,1
"I do love having the strap , and I do love being able to find a N in width .",POS,NULL,love,0
"I do love having the strap , and I do love being able to find a N in width .",POS,strap,love,0
I do not ususally order shoes but I was very pleased with this purchase and Peltz Shoes .,POS,Peltz Shoes,very pleased,0
"I do n't even do ballet anymore , I just love these tights .",POS,tights,love,0
I do n't know how anyone can fit in this,NEG,NULL,NULL,1
I do n't know if they are made to support the arch but I have n't noticed any arch problems .,POS,they,NULL,1
I do n't know why other makers do n't make their products shine - it 's so flattering .,POS,NULL,flattering,0
I do n't really like the tight waistband .,NEG,waistband,"do n't really like, tight",0
I do wish they had a little more cushioning in them .,NEG,they,NULL,1
I don't know how they fit because I am returning them due to the color .,POS,them,NULL,1
"I ended up having to go to the dance shop and buy another pair for recital , but these were fine for practicing .",POS,NULL,fine,0
I ended up ordering another pair in a size 8 and they fit great .,POS,they,great,0
I enjoy dancing with these shoes on my feet .,POS,shoes,NULL,1
I enjoyed wearing these slip-ons during the summer .,POS,slip-ons,enjoyed,0
"I even wear with work clothes sometimes , they are that comfortable !",POS,they,comfortable,0
I expected the waistband to be soft as well !,POS,waistband,soft,0
"I expected them to have a bit of padding inside the shoe , but they don't feel padded at all .",NEG,they,NULL,1
"I far , far prefer them .",POS,them,prefer,0
I feel like I 'm wearing slippers .,POS,NULL,NULL,1
I feel like they will last for a long time .,POS,they,NULL,1
I feel like this may actually be a 2 star product but I added an extra because I love the way they looked .,POS,they,love,0
I find them very comfortable to walk in which I appreciate since I usually need orthodic inserts .,POS,them,"very comfortable, appreciate",0
I followed the Capezio size guide and these were very small on my daughter .,NEG,NULL,very small,0
I followed the chart and these fit perfect.I actually do like to dance and be active in these .,POS,NULL,"like, perfect.I",0
I for this and a plain shirt under it in 30 degree weather and I stayed pretty warm .,POS,NULL,NULL,1
"I forget what others posted on sizing ... but larger than expected , I bought 2 sizes because I needed them ASAP ... love them !",POS,them,love,0
"I found these here , and ordered the same ones I had before , and am very happy about it .",POS,NULL,very happy,0
I gave 2 stars because the overnight shipping was so reasonable .,POS,overnight shipping,so reasonable,0
I gave it that rating rather than 5 stars because they do n't last as long as they should .,NEG,they,NULL,1
I gave it three stars since it probably looks nice on a medium to wide foot .,POS,NULL,nice,0
"I gave them to my super-petite daughter , and she loves them .",POS,them,loves,0
I get a lot of compliments too .,POS,NULL,compliments,0
I get complements on my legs at nearly every show I perform at !,POS,NULL,complements,0
I got a new muffin top from this .,NEG,NULL,NULL,1
I got the baby pink and it 's such a beautiful color !,POS,color,beautiful,0
"I got the item and it looked like a size XS and when I tried them on , I could n't even get them over my ankle .",NEG,them,NULL,1
I got the largest size because of my height but they are still a little short .,NEG,they,a little short,0
I got the light toast because they looked nude in the picture but they are way too dark for me .,NEG,they,too dark,0
"I got them and they are MUCH darker than my skin , not even remotely close to the shade shown in the picture .",NEG,they,MUCH darker,0
I got them for work and they have done very well .,POS,they,very well,0
I had bought a black pair before at a Bealls and loved them .,POS,them,loved,0
I had no discomfort during wear and no soreness after waltzing around for an hour on a hard dance floor .,POS,NULL,"no discomfort, no soreness",0
I had ordered a pair for Mothers Day and it 's exactly what I was looking for .,POS,NULL,NULL,1
I had to order the size smaller ( it fit beautifully ) .,POS,NULL,beautifully,0
I had to return these .,NEG,NULL,NULL,1
I had to send them back .,NEG,them,NULL,1
I hated them !,NEG,them,hated,0
"I have 2 other Minnetonka moccasins , both in a size 7 , which fit perfectly ( I usually take a 7-1/2 wide shoe or boot ) .",POS,Minnetonka moccasins,perfectly,0
I have a complaint about the black rubber sole and stacked heel - the rubber is too soft and the back of the heel mars very easily .,NEG,back of the heel,NULL,0
I have a complaint about the black rubber sole and stacked heel - the rubber is too soft and the back of the heel mars very easily .,NEG,rubber,too soft,0
"I have a high arch , and this shoe supports so well , you 'll forget you 're walking in heels .",POS,shoe,so well,0
I have a high arch and they give good support for my feet .,POS,they,good,0
"I have a narrow ( AA ) foot , so I was delighted that these sandals came in a narrow width .",POS,sandals,delighted,0
"I have a pair that lasted through six years of classes and four recitals , they 're still wearable .",POS,they,wearable,0
I have a skinny size 6 foot so I bought a 7 and it fits perfectly .,POS,NULL,perfectly,0
"I have always liked Port Authority polo shirts , but for some reason these faded quickly .",NEG,NULL,NULL,0
"I have always liked Port Authority polo shirts , but for some reason these faded quickly .",POS,Port Authority polo shirts,liked,0
I have always worn LifeStride shoes but was disappointed when they were not leather and they were made in China .,NEG,they,NULL,0
I have always worn LifeStride shoes but was disappointed when they were not leather and they were made in China .,NEG,shoes,disappointed,0
"I have been so pleased with this pair of boots , and the attention from the ladies has been more than appreciated !",POS,boots,"appreciated, so pleased",0
I have been wearing these same for years glad I could get again*the only Sandal that I found so comfortable .,POS,Sandal,"glad, NULL, so comfortable",0
I have bought a few pairs in different colors through the years and was always satisfied .,POS,NULL,always satisfied,0
"I have bought these shoes every summer for many , many years .",POS,shoes,NULL,1
I have bunions on both feet and the soft leather on the sides have just enough stretch to not bind or rub my bunions .,POS,leather,soft,0
I have enjoyed the sandals this summer .,POS,sandals,enjoyed,0
I have found that Capezio products tend to run a little small .,NEU,Capezio products,a little small,0
I have had ladies ask me where I got them because they look for comfortable while being attractive .,POS,they,"attractive, comfortable",0
"I have had problems with my feet all of my life , and Capezio Character shoes are great for the office !",POS,shoes,great,0
I have had really bad luck with amazon shoes .,NEG,shoes,NULL,1
I have had the same 3 shirts for 3 years now .,POS,shirts,NULL,1
"I have long legs though so I bought a B size and it is still a bit too small but if I went for a C size , the stockings probably would not have been snug on my legs ... Would recommend purchase - but if you are at all worried about size ; buy one size up .",NEG,stockings,"not have been snug, a bit too small",0
"I have long legs though so I bought a B size and it is still a bit too small but if I went for a C size , the stockings probably would not have been snug on my legs ... Would recommend purchase - but if you are at all worried about size ; buy one size up .",POS,NULL,recommend,0
"I have looked at these shoes for a year , and they are absolutely perfect .",POS,shoes,NULL,0
"I have looked at these shoes for a year , and they are absolutely perfect .",POS,they,absolutely perfect,0
"I have many bruises due to blood thinners , these are thicker than pantyhose but last much longer .",POS,NULL,much longer,0
"I have many bruises due to blood thinners , these are thicker than pantyhose but last much longer .",NEG,NULL,thicker,0
"I have Mimosa 's in three colors , camel , dark blue and red .",NEU,Mimosa 's,NULL,1
"I have much better luck with tights , but needed something that could serve the purpose of pantyhose on my closet .",POS,tights,much better,0
"I have never had a problem returning items bought on Amazon , but this seller takes the cake !",NEG,seller,NULL,1
I have now warn them 4 times and they have stayed in shape and look and feel great .,POS,they,great,0
"I have n't had an occasion to wear these yet , but I do plan to make them my go-to dress shoes .",POS,shoes,NULL,1
"I have n't had any trouble converting them , but it does take a second or two to wiggle my heel through the hole .",NEG,NULL,NULL,1
I have n't tried dancing in them but they seem great .,POS,they,great,0
"I have n't worn it with my party dresses , it looks too heavy and obvious .",NEG,NULL,"obvious, too heavy",0
"I have n't yet danced in them , but they seem much more durable than my other pair of tights .",POS,they,much more durable,0
"I have other pairs just like these sandals made by Naturalizer and absolutely loved them , they were called Mai Tai but they no longer make them .",POS,them,absolutely loved,0
I have pretty big ( athletic ) thighs and the tights needed to be adjusted a bit so that it did n't look see through on the big parts but they worked after the adjusting and they did n't run .,POS,tights,NULL,1
I have problem feet and need well fitting shoes and these work well .,POS,NULL,well,0
I have purchased several pairs of the same size shoe and this one was tighter both over the lower foot and through the heel strap .,NEG,heel strap,tighter,0
I have purchased several pairs of the same size shoe and this one was tighter both over the lower foot and through the heel strap .,NEG,lower foot,tighter,0
I have purchased several pairs of the same size shoe and this one was tighter both over the lower foot and through the heel strap .,NEG,this one,tighter,0
I have purchased these sandals two times - first time 3 years ago !,POS,sandals,NULL,1
I have several other styles of Minnetonka moccasins in 8 and 8 1/2 but for some reason these were way to big .,NEG,NULL,big,0
I have similar ones which I bought in the late 1980 's which have never pilled at all .,POS,similar ones,NULL,1
"I have spent a great deal of money on tights recently , and these are by far the best .",POS,tights,best,0
I have the same shoes in 3 different colors .,POS,shoes,NULL,1
I have this shoe in another color but this time I ordered a larger width and that did n't work but this is a nice shoe and very comfortable after it 's broken in .,NEG,NULL,NULL,0
I have this shoe in another color but this time I ordered a larger width and that did n't work but this is a nice shoe and very comfortable after it 's broken in .,POS,shoe,"nice, very comfortable",0
I have to return them but I 'll keep trying .,POS,them,NULL,1
I have to use inserts in all of my shoes ( including house slippers ) so these ended up being a little tight at first .,NEG,NULL,a little tight,0
I have trouble wearing heels but they felt good because of the heel issues I could not wear them for long .,POS,they,good,0
I have tugged and pulled on them with long nails and they have yet to snag or run .,POS,they,NULL,1
I have two dancers and we wo n't get anything else but Capezio tights .,POS,Capezio tights,NULL,1
I have two other sandals in different colors and they are the most comfortable sandal I have ever bought .,POS,sandal,most comfortable,0
I have used Danskin dancing tights and after 6 or so uses they just now have a run in them But these tights I have n't had the chance to wear them once .,NEG,tights,NULL,1
I have wore 1 time and received a number of positive compliments .,POS,NULL,"positive, compliments",0
I have worn them for years and they are always nice .,POS,they,nice,0
I have worn these for many years & have many colors .,POS,NULL,NULL,1
I have worn these shoes forever !,POS,shoes,NULL,1
I have worn this pair for a couple of hours now and hope that it will last as long as another pair which lasted me almost 20 years .,POS,another pair,NULL,1
I have yet to snag a pair of Capezio tights and they are such a breeze to launder .,POS,they,NULL,1
"I haven't worn them yet , but they are perfect for the All White Birthday Party I will be attending soon .",POS,they,perfect,0
I highly recommend it,POS,NULL,highly recommend,0
I highly recommend to all women !,POS,NULL,highly recommend,0
I honestly thought these would be sheer and have a slight sparkle to them but it is a bit darker than i expected the sheer is minimal but they were also 11.99 that not to bad i will find something to were them with if it does not work with the outfit i have picked for them .,NEG,them,NULL,1
I honestly thought these would be sheer and have a slight sparkle to them but it is a bit darker than i expected the sheer is minimal but they were also 11.99 that not to bad i will find something to were them with if it does not work with the outfit i have picked for them .,NEG,they,a bit darker,0
I hope this shoe is never discontinued .,POS,shoe,NULL,1
"I just got these shoes and I 'm excited at how comfortable they seem , even for my wide yoga feet .",POS,they,comfortable,0
I just guessed on size but they are n't too big,POS,they,NULL,1
I just tried them on and they are a great fit. < a data-hook=product-link-linked class=a-link-normal href=/Danskin-Women-s-Convertible-Tight/dp/B001U88UU8/ref=cm_cr_arp_d_rvw_txt ? ie=UTF8 > Danskin Women 's Convertible Tight < /a >,POS,they,great,0
I knew before I even tried it on that it would not fit .,NEG,NULL,not fit,0
I know I will always buy these tights .,POS,tights,NULL,1
"I know some suggested ordering a half size up , but since I have wide feet , ordering a size up was perfect ( FYI - street shoe size is different from dance shoes )",POS,NULL,perfect,0
I know that is common knowledge with dance gear and especially capezio ... so that is what I did and they were still too small .,NEG,they,too small,0
I like how they shimmer and make your legs look great !,POS,they,great,0
"I like it , however , the slingback is a little loose , but the rest of the fit feels very well .",NEG,slingback,a little loose,0
"I like it , however , the slingback is a little loose , but the rest of the fit feels very well .",POS,NULL,"very well, like",0
I like Life Stride .,POS,Life Stride,like,0
I like the appearance of the shoes very much - think they look very attractive .,POS,appearance,like,0
I like the appearance of the shoes very much - think they look very attractive .,POS,they,very attractive,0
I like the boots .,POS,boots,like,0
"I like the fleece lining , it helps to keep me warm , definitely a good buy .",POS,buy,good,0
"I like the fleece lining , it helps to keep me warm , definitely a good buy .",POS,fleece lining,"like, warm",0
I like the heel height and the style .,POS,heel height,like,0
