raw_words,sentiment,aspect,opinion,subjectivity
"( Because of the happening neighborhood , you might want to bring earplugs if you 're a light sleeper . )",NEG,neighborhood,NULL,1
( Note to anybody who is running Boston and books this place ... note that you have a sizeable ladder to climb to get up to the loft ... makes for a difficult climb up and down after those hills in Boston ) .,NEG,loft,difficult,0
"( That said , they have pretty high standards so the fact that they were comfortable in the apartment says a lot about how nice its amenities are ! )",POS,apartment,comfortable,0
"( That said , they have pretty high standards so the fact that they were comfortable in the apartment says a lot about how nice its amenities are ! )",POS,amenities,nice,0
( uber rides from here to anywhere are very reasonable ) We would not hesitate to stay here again if our travels brought us through Boston .,POS,NULL,very reasonable,0
") , and an easy walk to the subway .",POS,NULL,NULL,1
") , and being able to stumble out of bed right down to Park Street Station was extremely nice once we realized that the T is n't as daunting as it looks .",POS,NULL,NULL,1
": ) Overall , very clean and nice one bedroom unit .",POS,unit,"nice, very clean",0
": ) Very happy we chose this place , would absolutely stay here again on our next trip .",POS,place,Very happy,0
"1 block off of Boston Commons , walking distance to the Freedom Trail as well as Back Bay and Newbury Street .",POS,NULL,NULL,1
"1 person is great , it was my wife and I and we did n't have any issues but would not call it spacious .",NEU,NULL,would not call it spacious,0
10 min walk from the subway and very close to the city centre and AirPort .,POS,NULL,NULL,1
4 bedrooms for 3 people meant we got to spread out like divas !,POS,NULL,NULL,1
"5 minutes walk from the T station , 2 metro stations from the very city center .",POS,NULL,NULL,1
5 stahs !,POS,NULL,5 stahs,0
"5-7 minute Uber to MIT , 15 minute or less walk to Fenway , and of course - 0 minute walk to all the shops on Newbury .",POS,NULL,NULL,1
A charming brownstone home .,POS,home,charming,0
A comfortable and clean place .,POS,place,"comfortable, clean",0
A family neighborhood in a nice green house with ample parking on a dead end road .,POS,parking,ample,0
A family neighborhood in a nice green house with ample parking on a dead end road .,POS,house,nice,0
"A great location , walking distance to the waterfront , right on the freedom trail and next to Boston Common .",POS,location,"NULL, great",0
"A great location in central Boston , close to all of the necessities .",POS,location,"NULL, great",0
A great place - very comfortable bed and about 2 blocks to the nearest Metro station .,POS,place,great,0
A great place - very comfortable bed and about 2 blocks to the nearest Metro station .,POS,bed,very comfortable,0
A great place very close to downtown Boston .,POS,place,"great, NULL",0
A group of 5 of us stayed in the home for the labor day weekend and it worked out perfectly .,POS,NULL,perfectly,0
A little cramped with 4 people but doable .,NEU,NULL,"A little cramped, doable",0
"A little inconvenient that the bathroom is two floors below the bedroom , but not a deal breaker when it comes to booking this place !",NEG,bathroom,A little inconvenient,0
"A lovely , quiet , comfortable home , room has a beautiful view overlooking JP , and everything was as-expected or better .",POS,view,beautiful,0
"A lovely , quiet , comfortable home , room has a beautiful view overlooking JP , and everything was as-expected or better .",POS,NULL,better,0
"A lovely , quiet , comfortable home , room has a beautiful view overlooking JP , and everything was as-expected or better .",POS,home,"comfortable, quiet, lovely",0
A nice quiet get away in the busy city .,POS,NULL,"quiet, nice",0
A nice room with a comfy bed !,POS,bed,comfy,0
A nice room with a comfy bed !,POS,room,nice,0
A perfect airbnb experience !,POS,NULL,perfect,0
"A perfect little retreat , quietly nestled amongst the trees .",POS,NULL,"perfect, quietly",0
"A quiet , cozy , and comfortable place to relax and sleep .",POS,place,"quiet, comfortable, cozy",0
"A quiet , respectable place with a lovely view !",POS,view,lovely,0
"A quiet , respectable place with a lovely view !",POS,place,"quiet, respectable",0
A really fun place to stay !,POS,place,fun,0
A really nice room ( air-conditioned ) with fully equipped and well cleaned bathroom .,POS,bathroom,"fully, well",0
A really nice room ( air-conditioned ) with fully equipped and well cleaned bathroom .,POS,room,really nice,0
A really wonderful host and a beautiful home .,POS,home,beautiful,0
A really wonderful host and a beautiful home .,POS,host,really wonderful,0
A solid place .,POS,place,solid,0
A truly beautiful place in a perfect location,POS,location,perfect,0
A truly beautiful place in a perfect location,POS,place,truly beautiful,0
"A truly great location , and neat place !",POS,place,neat,0
"A truly great location , and neat place !",POS,location,truly great,0
A very minor and somewhat amusing con : the low part of the bathtub is at the opposite end from the drain .,NEG,bathtub,NULL,1
A very stylish and private room in the 3rd floor with lots of natural light and a VERY comfortable queen bed .,POS,queen bed,VERY comfortable,0
A very stylish and private room in the 3rd floor with lots of natural light and a VERY comfortable queen bed .,POS,room,"very stylish, private",0
A very well appointed studio apartment with a sleeping platform in a wonderful location .,POS,studio apartment,very well appointed,0
A very well appointed studio apartment with a sleeping platform in a wonderful location .,POS,location,wonderful,0
"A wonderful apartment , in a great building , at an absolutely magnificent location .",POS,location,absolutely magnificent,0
"A wonderful apartment , in a great building , at an absolutely magnificent location .",POS,building,great,0
"A wonderful apartment , in a great building , at an absolutely magnificent location .",POS,apartment,wonderful,0
A wonderful experience .,POS,NULL,wonderful,0
A wonderful location with great amenities and very clean .,POS,amenities,great,0
A wonderful location with great amenities and very clean .,POS,location,"very clean, wonderful",0
A wonderful place in a great location .,POS,location,great,0
A wonderful place in a great location .,POS,place,wonderful,0
A+++ location & host,POS,host,A+++,0
A+++ location & host,POS,location,A+++,0
A+++++++++,POS,NULL,NULL,1
Absolutely perfect location !,POS,location,Absolutely perfect,0
Absolutely recommend this place !,POS,place,Absolutely recommend,0
Absolutely the kind of stay that makes airbnb so great .,POS,airbnb,great,0
"Accurate description , great neighborhood , such a cute little space !",POS,description,Accurate,0
"Accurate description , great neighborhood , such a cute little space !",POS,space,cute,0
"Accurate description , great neighborhood , such a cute little space !",POS,neighborhood,great,0
"Accurate description , great neighborhood , such a cute little space !",NEG,space,little,0
"Acres of empty bookshelves , only one bedside table in all of the four bedrooms , arms of chairs and couches in the living room were loose .",NEG,bookshelves,empty,0
"Acres of empty bookshelves , only one bedside table in all of the four bedrooms , arms of chairs and couches in the living room were loose .",NEG,arms of chairs,loose,0
"Acres of empty bookshelves , only one bedside table in all of the four bedrooms , arms of chairs and couches in the living room were loose .",NEG,couches,loose,0
Added bonus is a wonderful gym with plenty of options within a 2-minute walk and free to use .,POS,gym,"wonderful, NULL",0
"Additionally , our flight got delayed due to weather and Jason still greeted us at the door at 4am .",POS,Jason,NULL,1
"After I left some items behind , Jason delivered them to the hotel where I was attending a convention .",POS,Jason,NULL,1
Again ... great place and people ! !,POS,people,great,0
Again ... great place and people ! !,POS,place,great,0
Air conditioner worked great .,POS,Air conditioner,great,0
All around awesome experience .,POS,NULL,awesome,0
All around great !,POS,NULL,great,0
All around I highly recommend this place .,POS,place,highly recommend,0
All arrangements were basically seamless .,POS,arrangements,basically seamless,0
All bedrooms very-well furnished .,POS,bedrooms,very-well,0
All but two of the rooms are air conditioned and all have comfortable beds .,POS,beds,comfortable,0
All but two of the rooms are air conditioned and all have comfortable beds .,POS,NULL,NULL,0
"All in all , a good space and great value .",POS,space,good,0
"All in all , a good space and great value .",POS,value,great,0
"All in all , Penny helped to make our first trip to Boston ( and first ever experience with air bnb ) extremely enjoyable and memorable .",POS,NULL,"extremely enjoyable, memorable",0
"All in all , Penny helped to make our first trip to Boston ( and first ever experience with air bnb ) extremely enjoyable and memorable .",POS,Penny,NULL,0
All in all a great rental that I recommend .,POS,NULL,"recommend, great",0
All in all a really good experience .,POS,NULL,good,0
All of the information provided was detailed and thorough .,POS,information,"thorough, detailed",0
All of the rooms were beautiful and the rooftop deck was a great bonus .,POS,rooms,beautiful,0
All of the rooms were beautiful and the rooftop deck was a great bonus .,POS,rooftop deck,great,0
All positive .,POS,NULL,positive,0
All review were accurate .,POS,review,accurate,0
All the amenities that you need for a stay .,POS,amenities,NULL,1
All the technicalities were really well handled from pre-communications to food available for breakfast and snacks .,POS,technicalities,really well,0
"Allowed early check-in , responded to all messages within minutes , great rooftop , perfect location !",POS,rooftop,great,0
"Allowed early check-in , responded to all messages within minutes , great rooftop , perfect location !",POS,NULL,NULL,0
"Allowed early check-in , responded to all messages within minutes , great rooftop , perfect location !",POS,check-in,NULL,0
"Allowed early check-in , responded to all messages within minutes , great rooftop , perfect location !",POS,location,perfect,0
Almost forgot ... the rooftop deck is INSANE !,POS,rooftop deck,INSANE,0
Alojamiento correcto,POS,Alojamiento,correcto,0
ALSO - do n't miss out on the gorgeous rooftop balcony .,POS,rooftop balcony,gorgeous,0
"Also , Brent was quick to respond to any questions I had .",POS,Brent,quick,0
"Also , I must say Valerie 's banana cake was amazing !",POS,Valerie 's banana cake,amazing,0
"Also , near public transportation .",POS,NULL,NULL,1
"Also , noted that the loft bed is really cozy , comfortable and the whole apt .",POS,loft bed,"really cozy, comfortable",0
"Also , the house is really nice , cozy and clean .",POS,house,"clean, really nice, cozy",0
"Also , the location was perfect ! !",POS,location,perfect,0
"Also , the roof deck is amazing and the view is incredible .",POS,roof deck,amazing,0
"Also , the roof deck is amazing and the view is incredible .",POS,view,incredible,0
"Also , Tiffany was an excellent host , responding to messages within the hour at all times .",POS,Tiffany,"NULL, excellent",0
"Also , we enjoyed talking and sharing memories during the amazing breakfast !",POS,breakfast,amazing,0
"Also , we tried turning on the TV downstairs and it does n't work as it 's not hooked up to anything so if you want to watch tv it 's only upstairs .",NEG,TV downstairs,NULL,1
"Also , we were trying to book the third night and she rented it to someone else after approving us for it and airbnb said the only way this would happen was if she had approved their rental .",NEG,NULL,NULL,1
Also ... it was nice that she did not jack the price up on Boston marathon weekend like all the other AirBnB people I messaged months in advance .,POS,NULL,NULL,1
Also a wonderful area to walk around .,POS,area,wonderful,0
Also answered all my follow up questions as well .,POS,NULL,NULL,1
Also great walking distance for a ton of local spots and a peaceful quiet neighborhood for enjoying Boston nights !,POS,NULL,great,0
Also great walking distance for a ton of local spots and a peaceful quiet neighborhood for enjoying Boston nights !,POS,neighborhood,"peaceful, quiet",0
"Also if you have issues with stairs , may not be the ideal place , but otherwise PERFECT .",NEG,stairs,not be the ideal,0
"Also if you have issues with stairs , may not be the ideal place , but otherwise PERFECT .",POS,NULL,PERFECT,0
Also thankful for the big umbrellas Todd had available for his guests as it rained one of the days during our stay .,POS,umbrellas,thankful,0
Also the bathroom was gorgeous - great shower .,POS,shower,"gorgeous, great",0
"Also there is parking available , which is a plus for me .",POS,parking,NULL,1
"Although I did not meet her in person , Jennifer was super responsive to queries and problems .",POS,Jennifer,super responsive,0
"Although I did n't meet the host , she made herself available for any questions and/or concerns .",POS,host,available,0
"Although Penny 's home had many good features , including beautiful art and throughout I most appreciated the cleanliness of the suite and the rest of the home .",POS,art,beautiful,0
"Although Penny 's home had many good features , including beautiful art and throughout I most appreciated the cleanliness of the suite and the rest of the home .",POS,features,good,0
"Although Penny 's home had many good features , including beautiful art and throughout I most appreciated the cleanliness of the suite and the rest of the home .",POS,home,most appreciated,0
"Although Penny 's home had many good features , including beautiful art and throughout I most appreciated the cleanliness of the suite and the rest of the home .",POS,suite,most appreciated,0
Although the apartment is large enough to receive guests it still has a cozy feel to it .,POS,apartment,"large, cozy",0
"Although the oblivious guest in the adjacent room was rather obnoxiously loud the first night of my stay ( from 10pm to past midnight ) , Todd quickly addressed the situation the next morning .",POS,Todd,quickly,0
Although we were not out too late at night we felt very safe walking back from the train .,POS,NULL,very safe,0
Amazing and beautiful home .,POS,home,"beautiful, Amazing",0
Amazing beautiful place .,POS,place,"Amazing, beautiful",0
"Amazing hosts , plus the bed is sooooo comfortable !",POS,hosts,Amazing,0
"Amazing hosts , plus the bed is sooooo comfortable !",POS,bed,sooooo comfortable,0
AMAZING LOCATION !,POS,LOCATION,AMAZING,0
"Amazing location , quaint classic Boston town home , very updated and family oriented .",POS,location,Amazing,0
"Amazing location , quaint classic Boston town home , very updated and family oriented .",POS,Boston town home,"quaint, classic",0
Amazing location and beautiful view of Seaport to wake up to !,POS,location,Amazing,0
Amazing location and beautiful view of Seaport to wake up to !,POS,view,beautiful,0
Amazing location and very good communication with Oine .,POS,location,Amazing,0
Amazing location and very good communication with Oine .,POS,communication,very good,0
Amazing place !,POS,place,Amazing,0
Amazing place not far from the center of Boston .,POS,place,Amazing,0
"Amazing place to stay in Boston , definitively recommended !",POS,place,"Amazing, definitively recommended",0
Amazing place to stay in Boston this family is friendly and loving .,POS,place,Amazing,0
Amazing place to stay in Boston this family is friendly and loving .,POS,family,"friendly, loving",0
Amazing views .,POS,views,Amazing,0
"An all-around excellent experience , highly recommend !",POS,NULL,"excellent, highly recommend",0
"And , the location was fantastic .",POS,location,fantastic,0
And a quiet place as well .,POS,NULL,quiet,0
And her cat is really lovely .,POS,cat,really lovely,0
And her home was conveniently located to the downtown and surrounding neigborhoods .,POS,home,conveniently,0
And if your into cooking your own food she has just about everything you could ever need ( Just beware of the tap water in the kitchen sink it comes out very cloudy even after letting it run for a little ) .,POS,kitchen,NULL,0
And if your into cooking your own food she has just about everything you could ever need ( Just beware of the tap water in the kitchen sink it comes out very cloudy even after letting it run for a little ) .,NEG,tap water,very cloudy,0
And Jamaica plaint is a quiet safety residential area .,POS,residential area,"safety, quiet",0
And location is fabulous and easy to take train to head to downtown less than half an hour .,POS,location,"fabulous, easy",0
And make sure you check it the roof !,POS,roof,NULL,1
And Oine was great .,POS,Oine,great,0
And she is a pleasure to deal with .,POS,NULL,pleasure,0
And the breakfast provided by the hosts was great .,POS,breakfast,great,0
And the grocery store stop & shop is just ahead .,POS,NULL,NULL,1
And the location is not too far from the downtown .,POS,location,NULL,1
And the rooftop deck alone was worth getting this place !,POS,rooftop deck,worth,0
"And they gave us very useful information about Boston , which helps us a lot .",POS,information,"very useful, helps",0
And Tiffany was the perfect hostess and very responsive to all our questions .,POS,Tiffany,"very responsive, perfect",0
And Tod is always on call to help .,POS,Tod,help,0
"And Valeria made banana bread for us , which is great .",POS,banana bread,great,0
And we definitely recommend spending time on the roof top deck !,POS,roof top deck,definitely recommend,0
Another great stay at one of Todd 's places !,POS,NULL,great,0
Another great stay at Todd 's house !,POS,NULL,great,0
Another great stay at Todd 's place .,POS,NULL,great,0
"Any problems or questions I had , Todd was quick to answer .",POS,Todd,quick,0
Any questions I had he promptly responded .,POS,NULL,promptly,0
Any questions I had were answered almost as quick as I emailed them .,POS,them,quick,0
Anyway I liked the room and I was able to reach downtown in 10 min driving .,POS,room,liked,0
Anyway I liked the room and I was able to reach downtown in 10 min driving .,POS,NULL,NULL,0
Apartment has modern amenities and is quite comfortable .,POS,amenities,modern,0
Apartment has modern amenities and is quite comfortable .,POS,Apartment,quite comfortable,0
Apartment is family friendly and comfortable .,POS,Apartment,"comfortable, family friendly",0
"Apartment was clean and well taken care of , she even provided travel toothpaste and shampoo .",POS,shampoo,NULL,0
"Apartment was clean and well taken care of , she even provided travel toothpaste and shampoo .",POS,toothpaste,NULL,0
"Apartment was clean and well taken care of , she even provided travel toothpaste and shampoo .",POS,Apartment,"well, clean",0
Apartment was just like the pictures and with the character of Boston !,POS,Apartment,NULL,1
Apartment was very clean and quaint and gives you a real Boston experience .,POS,Apartment,"quaint, very clean",0
Appreciate everything - thank you !,POS,NULL,"Appreciate, thank",0
Appreciated Cup of coffee and light breakfast .,POS,coffee,Appreciated,0
Appreciated Cup of coffee and light breakfast .,POS,breakfast,"Appreciated, light",0
Appreciated how accommodating Mark and Roman were throughout stay .,POS,Mark,Appreciated,0
Appreciated how accommodating Mark and Roman were throughout stay .,POS,Roman,Appreciated,0
Apt is nicely furnished and kept very clean .,POS,Apt,"very clean, nicely",0
"Area is safe and well lit , no frills in the unit but it is very clean and well appointed and a great value .",POS,value,great,0
"Area is safe and well lit , no frills in the unit but it is very clean and well appointed and a great value .",POS,Area,"safe, well",0
"Area is safe and well lit , no frills in the unit but it is very clean and well appointed and a great value .",POS,unit,"well, very clean",0
"Area is SUPER quiet , residential , a park is nearby less than a block , and overall good chill quiet mellow location .",POS,location,"mellow, chill, quiet, good",0
"Area is SUPER quiet , residential , a park is nearby less than a block , and overall good chill quiet mellow location .",POS,Area,SUPER quiet,0
Arrival and acess to appartment was very easy .,POS,Arrival,very easy,0
Arrival and acess to appartment was very easy .,POS,acess,very easy,0
Artsy feel .,POS,NULL,Artsy,0
"As a group of four university professors visiting Boston for a conference , Gloria 's apartment was both more economical and much grander than staying in a hotel would have been .",POS,'s apartment,"much grander, economical",0
"As a group of four university professors visiting Boston for a conference , Gloria 's apartment was both more economical and much grander than staying in a hotel would have been .",POS,Gloria,"much grander, economical",0
"As a guest , you have high privacy because your room is located at the loft and you have a private bathroom .",POS,privacy,high,0
"As a host , Tiffany was wonderful and attentive .",POS,Tiffany,"attentive, wonderful",0
As advertised and great location .,POS,location,great,0
"As an Airbnb Superhost myself , I 'd recommend Valerie 's home to future potential guests .",POS,Valerie 's home,recommend,0
"As far as location goes , it 's tough to do better .",POS,location,better,0
As for her place - it 's fabulous .,POS,place,fabulous,0
As it is a ground floor apartment with the family living above it can be noisy at times .,NEG,apartment,noisy,0
"Aside from that , it 's a lovely little room !",POS,room,lovely,0
"At first I panicked over internet connection , Luckily I waited for Kama , Who arrived in person , Solved it and kindly took me for an informative neighborhood tour .",POS,Kama,"kindly, Luckily, informative",0
At least we were able to eat @ Charlie 's Sandwich Shoppe right around the corner ( the Cranberry Griddle Cakes were SO yummy ! ),POS,NULL,NULL,1
Atleast half of the towels have brown/black stains .,NEG,towels,brown/black stains,0
Authentic neighborhood with great food in walking distance .,POS,neighborhood,NULL,1
Awesome !,POS,NULL,Awesome,0
Awesome Airbnb with beautiful views .,POS,Airbnb,Awesome,0
Awesome Airbnb with beautiful views .,POS,views,beautiful,0
Awesome all around !,POS,NULL,Awesome,0
Awesome experience great location close to everything and really simple handout thanks Gloria !,POS,NULL,Awesome,0
Awesome experience great location close to everything and really simple handout thanks Gloria !,POS,location,"great, NULL",0
Awesome experience great location close to everything and really simple handout thanks Gloria !,POS,handout,really simple,0
Awesome experience great location close to everything and really simple handout thanks Gloria !,POS,Gloria,thanks,0
"Awesome hosts , very comfortable and clean room .",POS,hosts,Awesome,0
"Awesome hosts , very comfortable and clean room .",POS,room,"very comfortable, clean",0
Awesome little spot a 5 minute walk from everything you could need .,POS,spot,"NULL, Awesome",0
"Awesome location , and an incredible view from the rooftop .",POS,location,Awesome,0
"Awesome location , and an incredible view from the rooftop .",POS,view,incredible,0
"Awesome location , close to the train and some great options for food .",POS,location,"Awesome, NULL",0
"Awesome location , close to the train and some great options for food .",POS,options,great,0
"Awesome location near the T station , with easy access to Back Bay and Downtown .",POS,location,"easy, Awesome, NULL",0
Awesome neighborhood and super attentive host .,POS,neighborhood,Awesome,0
Awesome neighborhood and super attentive host .,POS,host,super attentive,0
Awesome place and an awesome host !,POS,host,awesome,0
Awesome place and an awesome host !,POS,place,Awesome,0
"Awesome place just as listed , very clean , great location !",POS,location,great,0
"Awesome place just as listed , very clean , great location !",POS,place,"very clean, Awesome",0
Bare bones room to stay in while visiting Boston .,NEG,room,Bare,0
Bathroom is also very clean .,POS,Bathroom,very clean,0
Beacon Hill is beautiful and very quiet at night so it was nice to come back to that after being out in the busy city all day .,POS,Beacon Hill,"beautiful, nice, very quiet",0
"Beautiful , clean , apartment with an awesome view .",POS,view,awesome,0
"Beautiful , clean , apartment with an awesome view .",POS,apartment,"clean, Beautiful",0
"Beautiful apartment , great location , the walk into the city is a little long ( 20 minutes ) but doable .",NEG,location,a little long,0
"Beautiful apartment , great location , the walk into the city is a little long ( 20 minutes ) but doable .",POS,apartment,Beautiful,0
"Beautiful apartment , great location , the walk into the city is a little long ( 20 minutes ) but doable .",POS,location,"doable, great",0
Beautiful apartment in a great location .,POS,apartment,Beautiful,0
Beautiful apartment in a great location .,POS,location,great,0
Beautiful apartment with lots of natural light !,POS,apartment,"Beautiful, NULL",0
Beautiful brownstone apartment .,POS,apartment,Beautiful,0
Beautiful building .,POS,building,Beautiful,0
Beautiful home !,POS,home,Beautiful,0
Beautiful little retreat just minutes to Copley Square and bustling parts of Boston .,POS,NULL,NULL,1
Beautiful neighborhood with lots of restaurants and shops .,POS,neighborhood,Beautiful,0
Beautiful rooftop patio .,POS,rooftop patio,Beautiful,0
"Beautiful room , very clean , very comfy .",POS,room,"very clean, very comfy, Beautiful",0
"Beautiful view , great space .",POS,view,Beautiful,0
"Beautiful view , great space .",POS,space,great,0
