raw_words,sentiment,aspect,opinion,subjectivity
SO many things within walking distance or the T ( subway ) we would have loved to explore .,POS,NULL,NULL,1
"Some of the furniture in the house 's common areas could be updated , but it was totally adequate for our needs , along with a very comfy couch in front of the HDTV , which we enjoyed for Netflix nights .",POS,couch,"enjoyed, very comfy",0
"Some of the furniture in the house 's common areas could be updated , but it was totally adequate for our needs , along with a very comfy couch in front of the HDTV , which we enjoyed for Netflix nights .",POS,furniture,totally adequate,0
"Sorry Todd , we could n't meet but thank you !",POS,Todd,thank,0
Space only has 1 small window unit that is undersized for the property ( NOTE : host did provide fan upon request to move cool air from kitchen to living area ) .,NEG,window,small,0
"Spacious , comfortable and clean - a terrific value !",POS,NULL,"clean, Spacious, comfortable",0
"Spacious , comfortable and clean - a terrific value !",POS,value,terrific,0
Spacious and in a great location .,POS,location,great,0
Spacious and in a great location .,POS,NULL,Spacious,0
"Spent a wonderful day by the water , chatting with my girlfriend , going to restaurants ... a fabulous stay !",POS,NULL,fabulous,0
"Spotless , comfortable , nicely decorated .",POS,NULL,"comfortable, nicely, Spotless",0
Spotless and comfortable !,POS,NULL,"comfortable, Spotless",0
Spotlessly clean and super comfortable in a great location .,POS,location,great,0
Spotlessly clean and super comfortable in a great location .,POS,NULL,"super comfortable, Spotlessly clean",0
Stairs are not for older persons with bad knees .,NEG,Stairs,NULL,1
Star Super Market and authentic restaurants all around .,POS,NULL,NULL,1
Staying here helped make our overall experience of Boston even better .,POS,NULL,better,0
Staying with Penny was the best part of my trip to Boston and i am looking forward to next time i visit her again .,POS,Penny,best,0
Staying with Penny was the best part of my trip to Boston and i am looking forward to next time i visit her again .,POS,NULL,looking forward to,0
Steps away from Boston Common .,POS,NULL,NULL,1
Street parking was available and we never had an issue finding a spot .,POS,Street parking,NULL,1
Stunning views from the roof deck !,POS,views,Stunning,0
Stylish and cozy loft right smack in the middle of everything .,POS,loft,"cozy, NULL, Stylish",0
"Stylish furnishings , sparkling clean , fantastic location on Newbury Street - easy walking distance to restaurants and shops , but not too noisy at night .",NEU,location,not too noisy,0
"Stylish furnishings , sparkling clean , fantastic location on Newbury Street - easy walking distance to restaurants and shops , but not too noisy at night .",POS,location,"NULL, fantastic",0
"Stylish furnishings , sparkling clean , fantastic location on Newbury Street - easy walking distance to restaurants and shops , but not too noisy at night .",POS,NULL,sparkling clean,0
"Stylish furnishings , sparkling clean , fantastic location on Newbury Street - easy walking distance to restaurants and shops , but not too noisy at night .",POS,furnishings,Stylish,0
such a beautiful home with with amazing views and right in the middle of it all !,POS,views,amazing,0
such a beautiful home with with amazing views and right in the middle of it all !,POS,home,"beautiful, NULL",0
Such a great little gem of a place in an amazing location !,POS,location,amazing,0
Such a great little gem of a place in an amazing location !,POS,place,"great, gem",0
Such a great location and Tiffany made it a very easy experience !,POS,location,great,0
Such a great location and Tiffany made it a very easy experience !,POS,Tiffany,NULL,0
Such a great location and Tiffany made it a very easy experience !,POS,NULL,very easy,0
Such a great place,POS,place,great,0
Such a great place to stay !,POS,place,great,0
Such a great spot right in the heart of Allston .,POS,spot,great,0
Such an awesome experience at their place !,POS,NULL,awesome,0
"Such as , the hosts did have friends over one night in the kitchen , which made me feel uncomfortable taking a shower as we would have to do so about two feet from the party .",NEG,NULL,uncomfortable,0
"Super clean , and in the best part of town , located near everything you want to go to .",POS,NULL,"NULL, Super clean",0
Super clean .,POS,NULL,Super clean,0
Super clean and cozy too !,POS,NULL,"Super clean, cozy",0
Super close to the train and very short commute to the center of the city .,POS,NULL,NULL,1
Super comfortable and nice place to stay .,POS,place,"nice, Super comfortable",0
Super comfy .,POS,NULL,Super comfy,0
Super communicative and answered any and all questions super fast !,POS,NULL,"Super communicative, super fast",0
Super convenient !,POS,NULL,Super convenient,0
Super convenient location for walking to the T station .,POS,location,Super convenient,0
"Super cozy , very well stocked , and the perfect home base for travel around the city .",POS,home,perfect,0
"Super cozy , very well stocked , and the perfect home base for travel around the city .",POS,NULL,"Super cozy, very well stocked",0
Super cute place !,POS,place,Super cute,0
"Super easy check-in and out , and she was super responsive .",POS,check-in and out,Super easy,0
"Super easy check-in and out , and she was super responsive .",POS,NULL,super responsive,0
"Super friendly , gave great local restaurant recommendations and were amazing with the communication .",POS,communication,amazing,0
"Super friendly , gave great local restaurant recommendations and were amazing with the communication .",POS,local restaurant recommendations,great,0
"Super friendly , gave great local restaurant recommendations and were amazing with the communication .",POS,NULL,Super friendly,0
Super hosts and extremely convenient to the airport and downtown .,POS,NULL,extremely convenient,0
Super hosts and extremely convenient to the airport and downtown .,POS,hosts,Super,0
Super quiet neighborhood .,POS,neighborhood,Super quiet,0
Super responsive host .,POS,host,Super responsive,0
Super tidy space and good communication with the host,POS,communication,good,0
Super tidy space and good communication with the host,POS,space,Super tidy,0
"Surprisingly easy parking right outside , plus everything was clean and prepared well .",POS,parking,Surprisingly easy,0
"Surprisingly easy parking right outside , plus everything was clean and prepared well .",POS,NULL,"well, clean",0
"Taller guys , careful on the stairs though .",POS,stairs,NULL,1
"Tastefully decorated , amazing pressure water flow in the shower/tub .",POS,pressure water,amazing,0
"Tastefully decorated , amazing pressure water flow in the shower/tub .",POS,NULL,Tastefully,0
Terry also left us with an amazing amount of literature on Boston and the surrounding areas with places to eat and things to do .,POS,literature,amazing,0
Terry had everything ready for our early arrival into Boston .,POS,Terry,NULL,1
Terry helped us and gave us a baby bed .,POS,Terry,helped,0
Terry helped us out every time we needed it in terms of questions or problems .,POS,Terry,helped,0
"Terry is a great person , very helpful and easy to communicate with , he even allowed me for late check out without extra fees , the apartment is clean and comfortable with fast wifi .",POS,apartment,"clean, comfortable",0
"Terry is a great person , very helpful and easy to communicate with , he even allowed me for late check out without extra fees , the apartment is clean and comfortable with fast wifi .",POS,wifi,fast,0
"Terry is a great person , very helpful and easy to communicate with , he even allowed me for late check out without extra fees , the apartment is clean and comfortable with fast wifi .",POS,Terry,"great, easy, NULL, very helpful",0
Terry is a very nice and helpful host !,POS,Terry,"helpful, very nice",0
Terry is a very welcoming host and could n't be more helpful .,POS,Terry,"very welcoming, more helpful",0
Terry is very helpful .,POS,Terry,very helpful,0
Terry 's home was great .,POS,Terry 's home,great,0
Terry 's place is an amazing apartment .,POS,Terry 's place,amazing,0
Terry 's place is in a wonderful building and is decorated ( and stocked ) for a comfortable stay for active people .,POS,Terry 's place,comfortable,0
Terry 's place is in a wonderful building and is decorated ( and stocked ) for a comfortable stay for active people .,POS,building,wonderful,0
Terry 's place was a great stay .,POS,Terry 's place,great,0
Terry 's place was not only comfortable but was also tastefully decorated .,POS,Terry 's place,"tastefully, comfortable",0
Terry 's recommendations were fantastic !,POS,Terry 's recommendations,fantastic,0
Terry was a wonderful host .,POS,Terry,wonderful,0
Terry was also really quick to answer my questions and help when needed .,POS,Terry,"really quick, help",0
Terry was an excellent host !,POS,Terry,excellent,0
Terry was awesome and very accommodating to us .,POS,Terry,"awesome, very accommodating",0
Terry was easy to get a hold of and directions for getting to and into the apartment were very clear .,POS,Terry,easy,0
Terry was easy to get a hold of and directions for getting to and into the apartment were very clear .,POS,directions,very clear,0
Terry was quick to respond to any questions we had and was very accommodating to our needs .,POS,Terry,"quick, very accommodating",0
Terry was quick to respond to any requests or questions we had .,POS,Terry,quick,0
Terry was very helpful and the studio apartment was perfect for 2 people .,POS,studio apartment,perfect,0
Terry was very helpful and the studio apartment was perfect for 2 people .,POS,Terry,very helpful,0
Terry was very quick to our questions regarding laundry room .,POS,Terry,very quick,0
Terry was very responsive throughout the process .,POS,Terry,very responsive,0
Terry was very thorough in explaining how to get into the studio .,POS,Terry,very thorough,0
Thank you !,POS,NULL,Thank,0
"Thank you again , Mark",POS,Mark,Thank,0
Thank you again Gloria !,POS,Gloria,Thank,0
Thank you for amazing first experience with airbnb .,POS,NULL,"amazing, Thank",0
Thank you for everything .,POS,NULL,Thank,0
Thank you for everything Gloria !,POS,Gloria,Thank,0
Thank you for sharing your home .,POS,NULL,Thank,0
Thank you for your hospitality and generosity .,POS,NULL,"hospitality, generosity, Thank",0
"Thank you George , I will definitely come back to your place the next time I have to go to Boston .",POS,George,Thank,0
Thank you Jennifer !,POS,Jennifer,Thank,0
Thank you Mark !,POS,Mark,Thank,0
Thank you Oine !,POS,Oine,Thank,0
Thank you Penny,POS,Penny,Thank,0
Thank you Penny for a memorable weekend stay : - ),POS,NULL,memorable,0
Thank you Penny for a memorable weekend stay : - ),POS,Penny,Thank,0
Thank you so much !,POS,NULL,Thank,0
Thank you so much for a wonderful place to stay while in Boston .,POS,NULL,Thank,0
Thank you so much for a wonderful place to stay while in Boston .,POS,place,wonderful,0
Thank you so much for everything !,POS,NULL,Thank,0
Thank you so much Jason and Valerie !,POS,Jason and Valerie,Thank,0
Thank you Tiffany ! !,POS,Tiffany,Thank,0
Thank you Tiffany for such an amazing experience- it made our Boston trip all the more awesome !,POS,NULL,"awesome, amazing",0
Thank you Tiffany for such an amazing experience- it made our Boston trip all the more awesome !,POS,Tiffany,Thank,0
Thank you Todd,POS,Todd,Thank,0
Thanks,POS,NULL,Thanks,0
"Thanks , Gloria !",POS,Gloria,Thanks,0
"Thanks , Gloria for making our stay so enjoyable !",POS,Gloria,"so enjoyable, Thanks",0
"Thanks , Penny .",POS,Penny,Thanks,0
"Thanks , Todd !",POS,Todd,Thanks,0
Thanks again !,POS,NULL,Thanks,0
"Thanks again , Todd",POS,Todd,Thanks,0
Thanks again for a great stay !,POS,NULL,Thanks,0
Thanks again for being such great hosts and hopefully see each other again next time we visit Boston .,POS,hosts,"great, Thanks",0
Thanks again for being such great hosts and hopefully see each other again next time we visit Boston .,POS,NULL,hopefully,0
Thanks again for our lovely weekend in Boston !,POS,NULL,"Thanks, lovely",0
Thanks again Penny !,POS,Penny,Thanks,0
Thanks Brent !,POS,Brent,Thanks,0
Thanks for a great stay !,POS,NULL,"great, Thanks",0
"Thanks for a great stay , Penny !",POS,NULL,great,0
"Thanks for a great stay , Penny !",POS,Penny,Thanks,0
Thanks for all you attentions !,POS,NULL,Thanks,0
Thanks for being a great hostess Tiffany !,POS,Tiffany,"great, Thanks",0
Thanks for everything !,POS,NULL,Thanks,0
"Thanks for everything , Penny !",POS,Penny,Thanks,0
"Thanks for having me , you have a lovely listing !",POS,listing,lovely,0
"Thanks for having me , you have a lovely listing !",POS,NULL,Thanks,0
"Thanks for recommending the fireplace restaurant at Washington square , we had a great meal there !",POS,NULL,Thanks,0
Thanks for the great stay !,POS,NULL,"great, Thanks",0
Thanks for the stay !,POS,NULL,Thanks,0
Thanks for the toiletries !,POS,toiletries,Thanks,0
Thanks Gloria !,POS,Gloria,Thanks,0
Thanks Mark & Roman !,POS,Mark & Roman,Thanks,0
Thanks Penny for everything .,POS,Penny,Thanks,0
Thanks so much and if ever back in Boston we will book again !,POS,NULL,Thanks so much,0
Thanks so much for everything !,POS,NULL,Thanks so much,0
Thanks so much Gloria !,POS,Gloria,Thanks so much,0
Thanks so much Penny !,POS,Penny,Thanks so much,0
Thanks so much Terry !,POS,Terry,Thanks so much,0
Thanks Terry !,POS,Terry,Thanks,0
Thanks Tiffany !,POS,Tiffany,Thanks,0
Thanks Tiffany for a great stay !,POS,NULL,great,0
Thanks Tiffany for a great stay !,POS,Tiffany,Thanks,0
Thanks Todd !,POS,Todd,Thanks,0
Thanks very much guys ! !,POS,guys,Thanks very much,0
"That aside , I would recommend Penny 's home for your next stay in the Boston area .",POS,Penny 's home,recommend,0
"That being said , the only issue that we would share , is that the sleeper sofa mattress in unit 3 was basically springs between two pieces of material .",NEG,sleeper sofa mattress,NULL,1
"That 's very spacious , well-equipped , and beautiful .",POS,NULL,"very spacious, beautiful, well-equipped",0
"That said , when I arrived someone had forgot to flush the toilet and I 'm not talking just pee ( which makes me question if they cleaned anything ) .",NEG,they,NULL,1
"That said , when I arrived someone had forgot to flush the toilet and I 'm not talking just pee ( which makes me question if they cleaned anything ) .",NEG,toilet,NULL,1
"The $ 250 cleaning fee seemed pretty high though , for a fairly superficial cleaning .",NEG,cleaning,fairly superficial,0
"The $ 250 cleaning fee seemed pretty high though , for a fairly superficial cleaning .",POS,cleaning fee,pretty high,0
The AC is by two window units which worked well .,POS,AC,well,0
The accommodation is great .,POS,accommodation,great,0
"The accommodations were excellent , and the rooftop is beautiful !",POS,rooftop,beautiful,0
"The accommodations were excellent , and the rooftop is beautiful !",POS,accommodations,excellent,0
The accomodation was excellent - we did n't miss anything .,POS,accomodation,excellent,0
The accomodations are very spacious and it is in a prime location .,POS,location,prime,0
The accomodations are very spacious and it is in a prime location .,POS,accomodations,very spacious,0
The air conditioning was so appreciated !,POS,air conditioning,so appreciated,0
"The Airbnb was good overall , and Valerie and Jason are amazing people .",POS,Valerie and Jason,amazing,0
"The Airbnb was good overall , and Valerie and Jason are amazing people .",POS,Airbnb,good,0
"The apartment and location were exactly as described , the staff very thorough and kind in their communication via email .",POS,staff,"kind, very thorough",0
"The apartment being block away from the T means it 's easy to get basically anywhere , and we were also able to comfortably walk all over downtown .",POS,NULL,"NULL, comfortably",0
The apartment contained all the basic amenities and then some and the whole check-in and check-out process was seamless .,POS,amenities,NULL,0
The apartment contained all the basic amenities and then some and the whole check-in and check-out process was seamless .,POS,check-in,seamless,0
The apartment contained all the basic amenities and then some and the whole check-in and check-out process was seamless .,POS,check-out,seamless,0
The apartment has all the amenities you could need and is in a fantastic location .,POS,location,fantastic,0
The apartment has all the amenities you could need and is in a fantastic location .,POS,amenities,NULL,0
The apartment has tons of old hardware if you are into vintage stuff .,POS,apartment,vintage,0
The apartment in itself has a great location on a quite street right in the middle of Brookline .,POS,location,great,0
The apartment in itself has a great location on a quite street right in the middle of Brookline .,POS,street,quite,0
The apartment is a few stops from Downtown by rail and has plenty of shops and restaurants nearby to make a quick or long meal of depending on your schedule .,POS,apartment,NULL,1
The apartment is a good size and provided a great place to be between activities .,POS,size,good,0
The apartment is a good size and provided a great place to be between activities .,POS,place,great,0
"The apartment is a great value - kitchen and bathroom spaces are small , but updated ( kitchen ) and satisfactory ( bath ) .",POS,value,great,0
"The apartment is a great value - kitchen and bathroom spaces are small , but updated ( kitchen ) and satisfactory ( bath ) .",POS,bathroom,satisfactory,0
"The apartment is a great value - kitchen and bathroom spaces are small , but updated ( kitchen ) and satisfactory ( bath ) .",POS,kitchen,satisfactory,0
"The apartment is a little small for 4 adults , but that was the very LEAST of our concern when booking .",NEG,apartment,a little small,0
The apartment is a little smaller than I was expecting and the ladder to the loft bedroom is a little scary at first .,NEG,ladder to the loft bedroom,little scary,0
The apartment is adorable and it is in the best location .,POS,apartment,adorable,0
The apartment is adorable and it is in the best location .,POS,location,best,0
The apartment is central to virtually everything in Boston yet provides a quiet haven free from the hustle and bustle a City can bring .,POS,apartment,quiet,0
The apartment is clean and is perfect for relaxing after a full day of sight seeing .,POS,apartment,"clean, perfect, relaxing",0
The apartment is clean and with the clear explanation of Elisa and Todd is was easy to find .,POS,apartment,clean,0
The apartment is clean and with the clear explanation of Elisa and Todd is was easy to find .,POS,explanation,clear,0
"The Apartment is cozy , quite , Plenty of linen , Bathroom essentials and generous kitchen basics .",POS,Apartment,"cozy, quite",0
"The Apartment is cozy , quite , Plenty of linen , Bathroom essentials and generous kitchen basics .",POS,kitchen basics,generous,0
"The Apartment is cozy , quite , Plenty of linen , Bathroom essentials and generous kitchen basics .",POS,Bathroom essentials,Plenty,0
"The Apartment is cozy , quite , Plenty of linen , Bathroom essentials and generous kitchen basics .",POS,linen,Plenty,0
The apartment is cozy .,POS,apartment,cozy,0
"The apartment is exactly as it looks in the pictures , very clean and cozy .",POS,apartment,"very clean, cozy, NULL",0
"The apartment is great 2 for adults with convenient transportation , just a few minutes walk to the orange line .",POS,apartment,"great, convenient, NULL",0
"The apartment is great for a couple , has a decent size and is furnished with taste .",POS,size,decent,0
"The apartment is great for a couple , has a decent size and is furnished with taste .",POS,apartment,"great, taste",0
The apartment is ideally located in a quiet neighborhood with easy access to the T and many restaurants .,POS,apartment,ideally,0
The apartment is ideally located in a quiet neighborhood with easy access to the T and many restaurants .,POS,neighborhood,"quiet, easy",0
The apartment is in a fabulous location for shopping and dining .,POS,location,fabulous,0
"The apartment is in a great neighborhood , near the T , whole foods and the Bunker Hill Monument .",POS,neighborhood,"great, NULL",0
"The apartment is in a perfect location , near shops , restaurants and close to transportation to get all over Boston .",POS,location,"perfect, NULL",0
The apartment is in a pretty old brownstone with a big bay window overlooking all the action on Newbury Street .,POS,apartment,NULL,1
"The apartment is kept very clean , and nicely furnished .",POS,apartment,"nicely, very clean",0
"The apartment is located just a few steps off of Charles Street ... perfect for dining , coffee , and great boutique shopping .",POS,apartment,perfect,0
The apartment is located within walking distance of the Havard Campus and with public transport it will take you approx .,POS,apartment,NULL,1
The apartment is nice and modern .,POS,apartment,"nice, modern",0
The Apartment is perfectly located and a perfect place .,POS,Apartment,"perfectly, perfect",0
The apartment is pretty dirty and basically furnished .,NEG,apartment,pretty dirty,0
"The apartment is right in the center of Boston and the host , Brent was very good at communicating about check-in etc .",POS,apartment,NULL,0
"The apartment is right in the center of Boston and the host , Brent was very good at communicating about check-in etc .",POS,Brent,very good at communicating,0
The apartment is situated in a perfect place .,POS,place,perfect,0
"The apartment is spacious , clean and and quiet .",POS,apartment,"clean, spacious, quiet",0
"The apartment is very comfortable for two , it is in a prime spot and the host is very responsive and welcoming .",POS,spot,prime,0
"The apartment is very comfortable for two , it is in a prime spot and the host is very responsive and welcoming .",POS,apartment,very comfortable,0
"The apartment is very comfortable for two , it is in a prime spot and the host is very responsive and welcoming .",POS,host,"very responsive, welcoming",0
The apartment is very large and was ample for our group of 5 .,POS,apartment,"large, ample",0
The apartment is very nicely decorated and had all the amenities we could need .,POS,apartment,nicely,0
The apartment is very nicely decorated and had all the amenities we could need .,POS,amenities,NULL,0
The apartment is very pretty .,POS,apartment,very pretty,0
The apartment is very tidy !,POS,apartment,very tidy,0
The apartment is well equipped .,POS,apartment,well,0
The apartment is wonderful ... a perfect Boston experience .,POS,apartment,"wonderful, perfect",0
"The apartment itself does n't have a view , but there is a roof top patio with unbelievable views .",POS,views,unbelievable,0
"The apartment itself is a lovely , bright apartment with grand areas .",POS,areas,grand,0
"The apartment itself is a lovely , bright apartment with grand areas .",POS,apartment,"lovely, bright",0
The apartment itself is nice .,POS,apartment,nice,0
The apartment itself is perfectly located ... you walk out and you are in the center of Boston .,POS,apartment,perfectly,0
The apartment itself is pretty simple but it had everything I needed and the bed was comfortable .,POS,bed,comfortable,0
The apartment itself is pretty simple but it had everything I needed and the bed was comfortable .,POS,apartment,"pretty simple, NULL",0
The apartment itself is small and cozy with all of the necessities for a week-long stay .,POS,apartment,cozy,0
The apartment itself is stocked with everything you might need .,POS,apartment,NULL,1
The apartment itself is very cozy and quaint .,POS,apartment,"quaint, very cozy",0
The apartment itself is well maintained and Kama makes things even better with small amenities like a welcome tray with water and a couple of snacks .,POS,Kama,even better,0
The apartment itself is well maintained and Kama makes things even better with small amenities like a welcome tray with water and a couple of snacks .,POS,small amenities,welcome,0
The apartment itself is well maintained and Kama makes things even better with small amenities like a welcome tray with water and a couple of snacks .,POS,apartment,well,0
The apartment itself was clean and nice .,POS,apartment,"nice, clean",0
The apartment itself was clean with stylish touches .,POS,apartment,clean,0
The apartment itself was clean with stylish touches .,POS,touches,stylish,0
"The apartment itself was cozy and clean , everything was as expected from the listing .",POS,apartment,"clean, cozy",0
"The apartment itself was good , the futon easy to use and comfortable , the kit was great though it did not have all the essentials so check before you plan on making a meal .",POS,futon,"comfortable, easy",0
"The apartment itself was good , the futon easy to use and comfortable , the kit was great though it did not have all the essentials so check before you plan on making a meal .",POS,apartment,good,0
"The apartment itself was good , the futon easy to use and comfortable , the kit was great though it did not have all the essentials so check before you plan on making a meal .",POS,kit,great,0
"The apartment itself was good , the futon easy to use and comfortable , the kit was great though it did not have all the essentials so check before you plan on making a meal .",NEG,kit,NULL,0
The apartment 's location is superb and the apartment itself is fantastic .,POS,apartment,fantastic,0
The apartment 's location is superb and the apartment itself is fantastic .,POS,location,superb,0
The apartment was absolutely beautiful !,POS,apartment,absolutely beautiful,0
