raw_words,sentiment,aspect,opinion,subjectivity
I really enjoyed the hospitality as well as the privacy .,POS,hospitality as well as the privacy,enjoyed,0
"I really liked staying there because I felt very welcome , there were even snacks in the fridge : ) I liked the loft bedroom a lot .",POS,loft bedroom,liked,0
"I really liked staying there because I felt very welcome , there were even snacks in the fridge : ) I liked the loft bedroom a lot .",POS,snacks,NULL,0
"I really liked staying there because I felt very welcome , there were even snacks in the fridge : ) I liked the loft bedroom a lot .",POS,NULL,very welcome,0
I recommend Pennny 's place without hesitation .,POS,Pennny 's place,recommend,0
I recommend the place for 2 people or couple with a small child .,POS,place,recommend,0
I recommend their place .,POS,place,recommend,0
I recommend this house,POS,house,recommend,0
I recommend this place,POS,place,recommend,0
I saw Todd quickly one morning and mentioned the sink drained slowly in the bathroom .,NEG,sink,slowly,0
I spent only eight hours because I was on business travel and it was a welcome respite !,POS,NULL,welcome,0
"I stayed for one night and the check-in was seamless ( at 10PM , no less ) .",POS,check-in,seamless,0
"I stayed there with a friend on a Thanksgiving visit to Boston to see my family , and things went very smoothly , and Oine was quick to respond to any questions , despite the fact that it was a holiday .",POS,Oine,quick,0
"I stayed there with a friend on a Thanksgiving visit to Boston to see my family , and things went very smoothly , and Oine was quick to respond to any questions , despite the fact that it was a holiday .",POS,NULL,very smoothly,0
I stayed with Valerie and Jason for 2 nights and really enjoyed my time there .,POS,NULL,really enjoyed,0
I thank him for allowing me to camp out in his space when all of Boston was shut .,POS,NULL,thank,0
"I think its actually better than the photos show , quiet and up in the trees but walking distance to everything we needed in town .",POS,NULL,"NULL, better, quiet",0
I think the furniture could be updated but very good value for the area .,NEG,furniture,NULL,0
I think the furniture could be updated but very good value for the area .,POS,value,very good,0
I thoroughly enjoyed staying there .,POS,NULL,thoroughly enjoyed,0
I thought it was even nicer than the photos .,POS,NULL,even nicer,0
I throughly enjoyed the view .,POS,view,throughly enjoyed,0
"I travelled to Boston to visit Harvard Business School , and Todd 's place is perfectly located in about 10 minutes walking distance from HBS .",POS,Todd 's place,perfectly,0
I walked to Backbay & even Somerville !,POS,NULL,NULL,1
I was also able to order dinner and have it delivered through Seamless very easily as well .,POS,Seamless,very easily,0
"I was attending a conference at the Hynes Convention Center , and this was super convenient -only 5 min walk .",POS,NULL,super convenient,0
"I was aware from the description that the room would be on the third floor and the bathroom would be on the first , but it was difficult for me .",NEG,NULL,difficult,0
"I was here with my 65ish-year-old parents , and while they ended up being totally fine , I was nervous every time they walked up or down the stairs .",NEG,NULL,nervous,0
"I was impressed by the very clean , tastefully furnished bedroom , which was quite comfortable and felt almost like a guest room in a vacation home .",POS,bedroom,"very clean, quite comfortable, NULL, tastefully",0
I was in town for 2 nights and this room was perfect for my trip .,POS,room,perfect,0
I was living in Boston for 3 months and this airbnb was really confortable to live in .,POS,airbnb,really confortable,0
I was originally planning on taking the train into the downtown part of Boston and exploring that area during my stay but I loved Penny 's neighborhood in Jamaica Plain so much that I spent my entire day there !,POS,Penny 's neighborhood,loved,0
I was pleasantly surprised to stumble on Tiffany 's listing .,POS,Tiffany 's listing,pleasantly,0
"I was still able to book 2 of the 3 nights as she had preapproved me at the initial rate , but she would n't respond to my questions as she was presumably hoping to rent to someone at a higher rate .",NEG,NULL,NULL,1
I was there for a course at the Harvard Law school and everything I need was available .,POS,NULL,available,0
"I was traveling for business and was thankful for the WiFi , quiet , and ease of getting lyft back and forth to my meetings .",POS,NULL,"quiet, NULL",0
"I was traveling for business and was thankful for the WiFi , quiet , and ease of getting lyft back and forth to my meetings .",POS,WiFi,thankful,0
I was very impressed that she bought new sheets and an iron .,POS,iron,impressed,0
I was very impressed that she bought new sheets and an iron .,POS,sheets,"impressed, new",0
"I was visiting for work and needed a quiet , clean place to stay .",POS,place,"quiet, clean",0
"I will look forward to staying in Penny 's tree house , again .",POS,Penny 's tree house,look forward to,0
I would absolutely recommend his place to anyone and would absolutely stay here again if back in Boston .,POS,place,recommend,0
I would always recommend them as hosts .,POS,them,recommend,0
"I would come back any day to stay at Tiffany 's loft , it was so hard to leave !",POS,Tiffany 's loft,so hard to leave,0
I would definitely recommend a stay to anyone looking for a calm place to stay in the Boston area .,POS,NULL,definitely recommend,0
I would definitely recommend it .,POS,NULL,definitely recommend,0
I would definitely recommend this Oine 's place .,POS,Oine 's place,definitely recommend,0
I would definitely recommend this place to anyone looking to stay in Boston .,POS,place,definitely recommend,0
I would definitely recommend this place to anyone visiting Boston !,POS,place,definitely recommend,0
I would definitely recommend this place to everyone .,POS,place,definitely recommend,0
I would definitely recommend this place to friends .,POS,place,definitely recommend,0
I would definitely recommend this property .,POS,property,recommend,0
I would definitely recommend this to anyone !,POS,NULL,definitely recommend,0
I would definitely recommend Tiffany 's loft and will definitely stay again if we return to Boston !,POS,Tiffany 's loft,definitely recommend,0
I would definitely recommend you to stay here .,POS,NULL,definitely recommend,0
I would definitely stay at the property in the future and would highly recommend it to business travelers as well .,POS,property,highly recommend,0
I would give Todd more than 5 stars if the system accepted them ! !,POS,Todd,NULL,1
I would highly recommend !,POS,NULL,highly recommend,0
I would highly recommend it to others .,POS,NULL,highly recommend,0
I would highly recommend Oine as a host and her apartment .,POS,Oine,highly recommend,0
I would highly recommend Oine as a host and her apartment .,POS,apartment,highly recommend,0
I would highly recommend staying here !,POS,NULL,highly recommend,0
I would highly recommend this airbnb .,POS,airbnb,highly recommend,0
I would highly recommend this place .,POS,place,highly recommend,0
I would highly recommend this place to friends .,POS,place,highly recommend,0
I would highly recommend this studio for 1 or 2 people who want to enjoy a short stay in Boston .,POS,studio,highly recommend,0
I would highly recommend you stay with Tiffany when visiting Boston !,POS,NULL,highly recommend,0
I would like to recommend all my friends to choose this lovely place .,POS,place,"lovely, recommend",0
"I would like to reiterate that this place is very minimal , it is only a room and a fridge/coffee machine .",NEG,place,very minimal,0
I would love to recommand this place to the others .,POS,place,recommand,0
"I would love to stay at her place again ; like I stated before , she really made us feel so at home !",POS,NULL,NULL,1
I would rate her place : A+,POS,place,A+,0
"I would recommend a stay with Penny to anyone looking for a clean , comfortable place to stay in a diverse neighborhood of Boston .",POS,Penny,recommend,0
I would recommend and would definitely stay here again,POS,NULL,recommend,0
I would recommend the place and all in all was a positive and nice experience .,POS,place,"nice, recommend, positive",0
I would recommend this place .,POS,place,recommend,0
I would recommend this place and even stay again !,POS,place,recommend,0
I would recommend this place and will stay again if I get the chance !,POS,place,recommend,0
I would recommend this place to all and would absolutely rent from Tiffany again !,POS,place,recommend,0
I would recommend this to anyone and hope to come back and stay there again .,POS,NULL,recommend,0
"I would start by saying that Helena sought to provide anything I needed during my stay , and I am thankful for that .",POS,Helena,"NULL, thankful",0
"I would stay at her place again , and definitely reccomend her apartment to anyone looking for a place to stay in Boston .",POS,NULL,definitely reccomend,0
"I would stay here again , the host was so nice to accommodate my check in and check out times .",POS,host,so nice,0
I would visit again and recommend Tiffany 's loft to anyone visiting the city !,POS,Tiffany 's loft,recommend,0
"Ideal location near the Boston Common , Public Gardens , and the T. Loft was great and cozy !",POS,Loft,"great, cozy",0
"Ideal location near the Boston Common , Public Gardens , and the T. Loft was great and cozy !",POS,location,"Ideal, NULL",0
ideal location to train station within walking distance .,POS,location,"ideal, NULL",0
"If & when we 're able to revisit Boston , we 'll most definitely check for availability in Oine 's great home !",POS,NULL,great,0
If none of that bothers you the location is almost unbeatable ( we did not need to take a cab other than to/from the airport ) .,POS,location,almost unbeatable,0
"If you are looking for a friendly , comfortable home in an interesting area , look no further than Penny 's lovely home .",POS,home,lovely,0
"If you are looking for a place that you can rest in a good bed and have a great experience , this is your better choice .",POS,NULL,"better, great",0
"If you are looking for a place that you can rest in a good bed and have a great experience , this is your better choice .",POS,bed,good,0
"If you are looking for a place to sleep and close to Harvard , this is a great option .",POS,NULL,great,0
"If you are looking for a place to stay in Boston , I would highly recommend staying here .",POS,NULL,highly recommend,0
If you are over six foot you will not fit on the bed or the toilet not even close ( the loft the bed is in is about four feet high so you 're gon na have some trouble moving around ) .,NEG,toilet,not fit,0
If you are over six foot you will not fit on the bed or the toilet not even close ( the loft the bed is in is about four feet high so you 're gon na have some trouble moving around ) .,NEG,bed,"not fit, trouble",0
"If you do n't mind climbing stairs , I would recommend this house .",POS,house,recommend,0
"If you do n't mind filth , are prepared to come with your own cleaning supplies and a toolbox , have at it .",NEG,NULL,filth,0
"If you do n't need room service , a bar , TV , ... do n't hesitate , this is a lot cheaper without losing on the quality",POS,NULL,a lot cheaper,0
If you 're ever visiting Boston this is a great place to stay .,POS,place,great,0
"If you 're looking for a bustling spot this ai n't it , but it 's safe , quiet , relaxing , and easy for uber/lyft to get you into the heart of Cambridge in minutes .",POS,NULL,"quiet, safe, easy, relaxing",0
"If you want a full Boston experience , Tiffany 's place is in an AWESOME location .",POS,location,AWESOME,0
Immediate response and made everything so easy for us .,POS,NULL,"so easy, Immediate response",0
Impeccable location,POS,location,Impeccable,0
"In a very convenient location to get downtown , especially if you are just looking for a place to sleep each night .",POS,location,very convenient,0
"In addition , although her home is in quiet neighborhood , it is also in walking distance to a variety of shops and good restaurants .",POS,NULL,NULL,0
"In addition , although her home is in quiet neighborhood , it is also in walking distance to a variety of shops and good restaurants .",POS,neighborhood,quiet,0
"In addition , the place was sparkling clean and had all of the amenities necessary for our stay .",POS,amenities,NULL,0
"In addition , the place was sparkling clean and had all of the amenities necessary for our stay .",POS,place,sparkling clean,0
"In addition to a welcome treats of snacks , Tea , coffee and bottled water .",POS,treats,welcome,0
"In fact , I actually slept better at his place than at my own home !",POS,place,better,0
In our case we arrive early in the day from overseas and she worked with us for an early morning arrival .,POS,NULL,NULL,1
"In our experience , the best of all is the deck .",POS,deck,best,0
"In short , our stay at this apartment was absolutely incredible .",POS,apartment,absolutely incredible,0
"In summary , this property provided a great foundation for a successful tip to Boston and Harvard for us .",POS,NULL,great,0
"In terms of location , the house is ideally located for visiting the main sites and central Boston - a 10 minute walk to the airport station which takes you to the city in a couple of stops .",POS,location,"NULL, ideally",0
In the center of the center !,POS,NULL,NULL,1
"In the morning we had fresh-baked banana muffins which were delicious : ) Thank you so much for everything , I 'd recommend for anyone staying in Boston !",POS,banana muffins,"fresh-baked, delicious",0
"In the morning we had fresh-baked banana muffins which were delicious : ) Thank you so much for everything , I 'd recommend for anyone staying in Boston !",POS,NULL,"Thank, recommend",0
Inside Apt was a bit oppressive but we were out most of the time so it was ok . Set up for coffee making & some nice snacks on hand .,POS,Apt,a bit oppressive,0
Inside Apt was a bit oppressive but we were out most of the time so it was ok . Set up for coffee making & some nice snacks on hand .,POS,snacks,nice,0
Inside Apt was a bit oppressive but we were out most of the time so it was ok . Set up for coffee making & some nice snacks on hand .,NEU,Apt,ok,0
"Inside the apartment , it was very clean and well kept .",POS,apartment,"well, very clean",0
"Inside the unit , the apartment is well stocked .",POS,apartment,well,0
"Instructions were clear , the place was clean and quiet , I could n't have asked for a simpler InstantBook place !",POS,place,"clean, quiet",0
"Instructions were clear , the place was clean and quiet , I could n't have asked for a simpler InstantBook place !",POS,Instructions,clear,0
"Instructions were clear , the place was clean and quiet , I could n't have asked for a simpler InstantBook place !",POS,InstantBook,simpler,0
"Interesting neighbourhood ( Jamaica Plain ) , Penny has lots of recommendations for shops , restaurants , etc .",POS,neighbourhood,Interesting,0
"Interesting neighbourhood ( Jamaica Plain ) , Penny has lots of recommendations for shops , restaurants , etc .",POS,recommendations,NULL,0
Internet a bit spotty .,NEG,Internet,a bit spotty,0
Internet connection is occasionally very slow .,NEG,Internet connection,occasionally very slow,0
is in a very quiet residential neighborhood only a mile away from Harvard Square -- 20 minute walk or a quick bus ride .,POS,NULL,NULL,0
is in a very quiet residential neighborhood only a mile away from Harvard Square -- 20 minute walk or a quick bus ride .,POS,residential neighborhood,very quiet,0
It allowed us several extra hours of being able to explore Boston without luggage !,POS,NULL,NULL,1
"It also does n't hurt that JFK used to live on the same floor , some cool history .",POS,NULL,cool,0
It could n't have been a more pleasant experience from the second we booked to when he left .,POS,NULL,more pleasant,0
It even looks bigger than its photos .,POS,NULL,bigger,0
It felt like I was staying at a family members house .,POS,NULL,NULL,1
"It felt like really living in Boston , not just passing by for a few days .",POS,NULL,NULL,1
It got way too hot in the apartment as it 's controlled by the building and unable to be adjusted .,NEG,apartment,"too hot, NULL",0
It had easy parking as well as being right by the subway stop for people who prefer not to drive in boston .,POS,parking,easy,0
It had easy parking as well as being right by the subway stop for people who prefer not to drive in boston .,POS,NULL,NULL,0
It had everything that you would need for a great stay .,POS,NULL,great,0
It had serious historic charm and some great modern design features as well .,POS,design features,"great, modern",0
It had serious historic charm and some great modern design features as well .,POS,NULL,serious historic charm,0
"It has 3 bedrooms , 1 bathroom very clean that had all the amenities and a kitchen very well equipped .",POS,amenities,NULL,0
"It has 3 bedrooms , 1 bathroom very clean that had all the amenities and a kitchen very well equipped .",POS,bathroom,very clean,0
"It has 3 bedrooms , 1 bathroom very clean that had all the amenities and a kitchen very well equipped .",POS,kitchen,very well,0
It has a charming old character .,POS,NULL,charming,0
It has a great view on the piers and water .,POS,NULL,NULL,1
It has a loft bed via a ladder ... with a world class bedtime reading library .,POS,bedtime reading library,world class,0
It has a nice view .,POS,view,nice,0
It has beautiful high ceilings and big windows .,POS,high ceilings,beautiful,0
It has beautiful high ceilings and big windows .,POS,windows,big,0
"It has lots of different areas to spread out - the cosy kitchen , the quiet study , the grand upstairs , and the amazing roof terrace .",POS,roof terrace,amazing,0
"It has lots of different areas to spread out - the cosy kitchen , the quiet study , the grand upstairs , and the amazing roof terrace .",POS,kitchen,cosy,0
"It has lots of different areas to spread out - the cosy kitchen , the quiet study , the grand upstairs , and the amazing roof terrace .",POS,upstairs,grand,0
"It has lots of different areas to spread out - the cosy kitchen , the quiet study , the grand upstairs , and the amazing roof terrace .",POS,study,quiet,0
It helped make Boston feel like home for a day .,POS,NULL,NULL,1
"It is a one room apartment , with a kitchen that is not fully equiped .",NEG,kitchen,NULL,1
It is a rare opportunity to stay in such a great neighborhood of old Boston .,POS,neighborhood,great,0
It is a safe and quiet neighbourhood .,POS,neighbourhood,"safe, quiet",0
It is a very good place to stay .,POS,place,very good,0
It is a wonderful place in a fabulous location .,POS,location,fabulous,0
It is a wonderful place in a fabulous location .,POS,place,wonderful,0
It is also close to Harvard square .,POS,NULL,NULL,1
It is also close to the airport for those flying in .,POS,NULL,NULL,1
It is also very close to the T so it 's easy to get around the city from here .,POS,NULL,"easy, NULL",0
It is centrally located as we walked almost everywhere .,POS,NULL,centrally,0
It is clean and exactly what I needed .,POS,NULL,clean,0
It is clear she loves her location and Boston and is full of helpful ideas and suggestions .,POS,ideas,helpful,0
It is clear she loves her location and Boston and is full of helpful ideas and suggestions .,POS,suggestions,helpful,0
It is close to bus stops where you can take a bus to train stations .,POS,NULL,NULL,1
It is close to just about anything you could ever want in Boston .,POS,NULL,NULL,1
"It is entirely private , as it is located on its own floor of the town house .",POS,NULL,entirely private,0
"It is great for the younger crowd - if you are over 40 ( as we are ) , be aware that you are actually climbing up and down a ladder into a homemade loft to a mattress on a floor w/ a very low ceiling .",POS,NULL,great,0
"It is in an excellent location for public transportation , but is off the main roads so it is quiet and safe .",POS,location,excellent,0
"It is in an excellent location for public transportation , but is off the main roads so it is quiet and safe .",POS,NULL,"safe, quiet",0
It is literally right next to everything .,POS,NULL,NULL,1
It is located a short walk from the train which will take you right to downtown in 10-15 min .,POS,NULL,short,0
"It is located in a charming neighborhood closed to Harvard Business , and there is a bus that takes you to Harvard square If you are looking for a place which is nice , welcoming and very clean you definitely will be very happy with your stay here !",POS,neighborhood,charming,0
"It is located in a charming neighborhood closed to Harvard Business , and there is a bus that takes you to Harvard square If you are looking for a place which is nice , welcoming and very clean you definitely will be very happy with your stay here !",POS,NULL,NULL,0
"It is located in a nice neighborhood and a short walk to the T. It offered the conveniences of a motel , as well as the privacy we were hoping for .",POS,neighborhood,nice,0
"It is located in a nice neighborhood and a short walk to the T. It offered the conveniences of a motel , as well as the privacy we were hoping for .",POS,NULL,NULL,0
It is located in a pretty quite area .,POS,area,pretty quite,0
It is located just a couple of blocks away from the Bunker Hill monument and is very convenient for working or visiting the naval dock area .,POS,NULL,very convenient,0
It is located on a somewhat steep hill off the main street .,NEG,hill,somewhat steep,0
It is located right at the beginning of the Freedom Trail and is an easy 15 minute walk from anywhere you want to go .,POS,NULL,NULL,1
It is on the 4th floor and the elevator is quaint at best - not acceptable from the first floor .,POS,elevator,quaint,0
"It is rather small , but that seems to be the standard in the area .",NEG,NULL,rather small,0
"It is small , but it was perfect size for me and my husband for a few days .",POS,size,perfect,0
"It is small , but it was perfect size for me and my husband for a few days .",NEG,NULL,small,0
It is such a perfect location and was ( for such a tiny space ) so comfortable and convenient .,POS,location,"perfect, convenient",0
It is such a perfect location and was ( for such a tiny space ) so comfortable and convenient .,POS,NULL,so comfortable,0
It is such a perfect location and was ( for such a tiny space ) so comfortable and convenient .,POS,space,tiny,0
It is very clean and comfy .,POS,NULL,"comfy, very clean",0
"It is very quiet , clean and modern .",POS,NULL,"modern, very quiet, clean",0
It is walking distance to Whole foods etc and I felt comfortable walking by myself at night .,POS,NULL,"comfortable, NULL",0
"It looks brand new , clean , modern , great linens , private entrance , and great location .",POS,linens,great,0
"It looks brand new , clean , modern , great linens , private entrance , and great location .",POS,location,great,0
"It looks brand new , clean , modern , great linens , private entrance , and great location .",POS,NULL,"modern, clean",0
"It made me a little uncomfortable when accompanied with not being able to use the kitchen , because I felt as though all the tenants did not want me there .",NEG,NULL,a little uncomfortable,0
"It never took us more than five or ten minutes to walk to the public transportation stations nearby , and from there we could go anywhere .",POS,NULL,NULL,1
"It really is in the heart of Charlestown , just a few short blocks from the Bunker Hill Monument .",POS,NULL,NULL,1
"It 's a charming place in the heart of the city , with many sites , restaurants , and shops within walking distance .",POS,place,"NULL, charming",0
It 's a good place and will definitely consider to come again .,POS,place,good,0
It 's a great location .,POS,location,great,0
"It 's a great place for two people , but would not recommend it for 3 people especially because the pull out bed is extremely uncomfortable .",NEG,pull out bed,extremely uncomfortable,0
"It 's a great place for two people , but would not recommend it for 3 people especially because the pull out bed is extremely uncomfortable .",POS,place,great,0
It 's a nice quiet apartment .,POS,apartment,"quiet, nice",0
"It 's a short ( if ugly ) walk to restaurants and bars , and a quiet place to sleep at night .",POS,place,"quiet, NULL",0
It 's a short walk to the T ride into central Boston and there is a handy bus nearby too .,POS,NULL,NULL,1
It 's a very short walk to the bus and train .,POS,NULL,very short,0
It 's a very tidy and secure apartment .,POS,apartment,"secure, very tidy",0
It 's also an easy walk to the Museum of Fine Arts .,POS,NULL,easy,0
"It 's also in a beautiful neighbourhood , which is safe , central , and wonderfully served for coffee houses , restaurants , bars and shops .",POS,neighbourhood,"beautiful, central, safe, wonderfully",0
"It 's also just a 10 minute walk to the closest T line station , Airport , so it 's convenient for getting into the city or to the airport for flights .",POS,NULL,"NULL, convenient",0
"It 's an easy walk to HBS campus ( about 10 min ) , or an easy Uber to anywhere in Boston for about $ 8-10 .",POS,NULL,"easy, easy",0
It 's an easy walk to most everything in Boston though .,POS,NULL,NULL,1
"It 's at the center of everything and is in walking distance from clubs , bars , the water , and historic area .",POS,NULL,NULL,1
It 's awesome .,POS,NULL,awesome,0
It 's convenient and in walking distance to everything .,POS,NULL,convenient,0
It 's easy to see this space is very well cared for and that the host puts a lot of effort into making sure guests have everything they need .,POS,space,"very well, NULL",0
